name,price,category,brand,target
aro de aco rolete polegada axion,24.9,complementos,AXION,2
luva soldavel com rosca em pvc pol fortlev,1.89,conexoes,FORTLEV,3
te reducao esgoto sn em pvc branco fortlev,16.9,conexoes,FORTLEV,3
te esgoto sn em pvc branco fortlev,2.59,conexoes,FORTLEV,3
ralo sifonado quadrado em pvc xxmm branco fortlev,10.9,conexoes,FORTLEV,3
reducao excentrica esgoto sn em pvc branco fortlev,7.9,conexoes,FORTLEV,3
luva simples esgoto sn em pvc branco fortlev,1.2,conexoes,FORTLEV,3
juncao reducao simples esgoto sn em pvc branco fortlev,25.9,conexoes,FORTLEV,3
juncao simples esgoto sn em pvc branco fortlev,20.9,conexoes,FORTLEV,3
joelho esgoto sn em pvc branco fortlev,2.2,conexoes,FORTLEV,3
luva de correr para tubo esgoto sn em pvc branco fortlev,12.9,conexoes,FORTLEV,3
joelho esgoto com visita sn em pvc branco fortlev,19.9,conexoes,FORTLEV,3
curva curta esgoto sn em pvc branco fortlev,19.9,conexoes,FORTLEV,3
curva longa esgoto sn em pvc branco fortlev,39.9,conexoes,FORTLEV,3
cap esgoto sn em pvc branco fortlev,2.3,conexoes,FORTLEV,3
bucha de reducao longa esgoto em pvc branco fortlev,1.89,conexoes,FORTLEV,3
te soldavel com rosca em pvc pol fortlev,2.89,conexoes,FORTLEV,3
te soldavel em pvc com bucha de latao pol azul fortlev,7.7,conexoes,FORTLEV,3
joelho soldavel em pvc com bucha de latao pol azul fortlev,5.9,conexoes,FORTLEV,3
luva soldavel em pvc com bucha de latao pol azul fortlev,4.3,conexoes,FORTLEV,3
te de reducao soldavel em pvc fortlev,9.6,conexoes,FORTLEV,3
uniao soldavel em pvc fortlev,7.5,conexoes,FORTLEV,3
luva de reducao soldavel em pvc fortlev,1.4,conexoes,FORTLEV,3
luva de correr para tubo soldavel em pvc fortlev,19.9,conexoes,FORTLEV,3
te soldavel em pvc fortlev,0.79,conexoes,FORTLEV,3
luva soldavel em pvc fortlev,2.99,conexoes,FORTLEV,3
joelho soldavel com rosca em pvc pol fortlev,2.3,conexoes,FORTLEV,3
joelho soldavel em pvc fortlev,0.99,conexoes,FORTLEV,3
joelho de reducao soldavel em pvc fortlev,2.99,conexoes,FORTLEV,3
cap soldavel em pvc fortlev,12.9,conexoes,FORTLEV,3
curva soldavel em pvc fortlev,2.3,conexoes,FORTLEV,3
bucha de reducao soldavel longa em pvc fortlev,4.4,conexoes,FORTLEV,3
bucha de reducao soldavel curta em pvc fortlev,0.99,conexoes,FORTLEV,3
adaptador soldavel curto em pvc pol fortlev,12.9,conexoes,FORTLEV,3
bucha de reducao em pvc soldavel curta marrom fortlev,0.49,conexoes,FORTLEV,3
joelho soldavel pvc marrom fortlev,0.39,conexoes,FORTLEV,3
adaptador soldavel em pvc pol com anel para caixa dagua fortlev,36.9,conexoes,FORTLEV,3
conector macho cpvc polegadas aquatherm tigre,45.49,conexoes,TIGRE,3
conector macho cpvc polegadas aquaterm tigre,515.9,conexoes,TIGRE,3
luva de transicao cpvc polegadas aquatherm tigre,99.9,conexoes,TIGRE,3
luva transicao cpvc aquatherm tigre,185.99,conexoes,TIGRE,3
luva de transicao aquatherm branco tigre,14.9,conexoes,TIGRE,3
conector macho cpvc aquaterm tigre,219.9,conexoes,TIGRE,3
joelho de transicao cpvc polegada aquatherm tigre,31.9,conexoes,TIGRE,3
luva de correr em pvc para coletor de esgoto tigre,18.69,conexoes,TIGRE,3
te de latao tipo y xx g cromado blukit,99.9,conexoes,BLUKIT,3
luva de latao cromado blukit,18.9,conexoes,BLUKIT,3
juncao de esgoto para reducao simples pvc serie r tigre,51.9,conexoes,TIGRE,3
cap roscavel pvc polegadas tigre,44.39,conexoes,TIGRE,3
te de reducao de esgoto pvc serie r tigre,58.59,conexoes,TIGRE,3
te de esgoto pvc serie r tigre,24.39,conexoes,TIGRE,3
cap de esgoto pvc serie r tigrecap de esgoto pvc serie r tigre,12.79,conexoes,TIGRE,3
adaptador para maquina de lavar branco tigre,29.9,conexoes,TIGRE,3
mangote pvc polegadas succao de agua espiral azul perfilnor,25.9,conexoes,PLASNOR,3
te de reducao pvc aquatherm tigre,7.89,conexoes,TIGRE,3
te de reducao cpvc aquatherm tigre,4.9,conexoes,TIGRE,3
bucha de reducao cpvc aquatherm tigre,32.99,conexoes,TIGRE,3
adaptador ralo linear para caixa sifonada pvc tigre,19.99,conexoes,TIGRE,3
te de reducao soldavel pvc tigre,216.99,conexoes,TIGRE,3
uniao tubo pvc aquatherm tigre,31.9,conexoes,TIGRE,3
conector macho cpvc polegada aquatherm tigre,24.99,conexoes,TIGRE,3
curva galvalume retangular calha forte,33.9,conexoes,CALHA FORTE,3
uniao soldavel pvc aquatherm tigre,51.9,conexoes,TIGRE,3
juncao de esgoto pvc simples tigre,479.9,conexoes,TIGRE,3
joelho esgoto pvc g tigre,218.89,conexoes,TIGRE,3
luva de esgoto simples pvc tigre,52.9,conexoes,TIGRE,3
te de reducao soldavel tigre,125.9,conexoes,TIGRE,3
te de esgoto pvc tigre,314.99,conexoes,TIGRE,3
curva de esgoto pvc graus longa tigre,499.9,conexoes,TIGRE,3
te soldavel cpvc aquatherm tigre,219.9,conexoes,TIGRE,3
adaptador soldavel pvc caixa agua longa tigre,21.9,conexoes,TIGRE,3
joelho cpvc g aquatherm tigre,139.9,conexoes,TIGRE,3
te de reducao pvc soldavel tigre,9.99,conexoes,TIGRE,3
uniao soldavel cpvc aquatherm tigre,157.9,conexoes,TIGRE,3
luva soldavel cpvc aquatherm tigre,183.9,conexoes,TIGRE,3
bucha de reducao roscavel cpvc polegadas tigre,46.59,conexoes,TIGRE,3
joelho soldavel cpvc graus aquatherm tigre,257.9,conexoes,TIGRE,3
cap soldavel cpvc aquatherm tigre,179.9,conexoes,TIGRE,3
adaptador soldavel pvc para caixa d'agua longo tigre,289.9,conexoes,TIGRE,3
joelho soldavel g cpvc aquatherm tigre,142.9,conexoes,TIGRE,3
te de inspecao e reducao para esgoto pvc serie r tigre,72.79,conexoes,TIGRE,3
cap esgoto pvc tigre,134.9,conexoes,TIGRE,3
adaptador soldavel pvc longa caixa agua tigre,30.9,conexoes,TIGRE,3
joelho circular pvc graus aquapluv style branco tigre,25.9,conexoes,TIGRE,3
bucha reducao cpvc aquatherm tigre,199.99,conexoes,TIGRE,3
curva roscavel de pvc polegadas tigre,43.49,conexoes,TIGRE,3
joelho soldavel cpvc g aquatherm tigre,21.9,conexoes,TIGRE,3
bucha de reducao aquatherm branco tigre,191.9,conexoes,TIGRE,3
joelho esgoto pvc graus serie r tigre,4.89,conexoes,TIGRE,3
joelho para esgoto pvc serie reforcada tigre,8.79,conexoes,TIGRE,3
joelho circular pvc transicao aquapluv style e beiral bege tigre,38.9,conexoes,TIGRE,3
adaptador soldavel pvc caixa d agua registro tigre,115.9,conexoes,TIGRE,3
juncao esgoto pvc simples serie reforcada tigre,9.9,conexoes,TIGRE,3
luva de esgoto pvc simples serie reforcada branca tigre,10.9,conexoes,TIGRE,3
luva soldavel pvc com bucha de latao tigre,19.9,conexoes,TIGRE,3
curva esgoto pvc g longa tigre,141.9,conexoes,TIGRE,3
joelho retencao pvc graus aquapluv style branco tigre,26.79,conexoes,TIGRE,3
joelho circular pvc g aquapluv style e beiral bege tigre,28.89,conexoes,TIGRE,3
juncao de esgoto simples pvc serie r tigre,197.99,conexoes,TIGRE,3
luva de esgoto simples pvc serie r tigre,5.89,conexoes,TIGRE,3
adaptador soldavel curto pvc polegadas tigre,7.89,conexoes,TIGRE,3
joelho de reducao com visita pvc serie r tigre,52.9,conexoes,TIGRE,3
te de reducao pvc dexmm pba je bbb tigre,147.99,conexoes,TIGRE,3
luva reducao pvc soldavel tigre,15.69,conexoes,TIGRE,3
te de reducao pvc dexmm pba junta elastica bbb tigre,86.59,conexoes,TIGRE,3
curva roscavel pvc g tigre,7.9,conexoes,TIGRE,3
joelho reducao pvc g roscavel bucha latao tigre,26.9,conexoes,TIGRE,3
curva roscavel pvc graus tigre,125.9,conexoes,TIGRE,3
curva soldavel pvc g tigre,85.9,conexoes,TIGRE,3
te reducao pvc soldavel tigre,54.9,conexoes,TIGRE,3
juncao reducao esgoto pvc invertida tigre,13.69,conexoes,TIGRE,3
bucha de reducao longa pvc serie r tigre,7.85,conexoes,TIGRE,3
juncao dupla de esgoto pvc tigre,41.99,conexoes,TIGRE,3
luva soldavel com rosca pvc tigre,23.9,conexoes,TIGRE,3
joelho roscavel com bucha de latao pvc polegada graus tigre,20.29,conexoes,TIGRE,3
te de inspecao de esgoto pvc tigre,35.9,conexoes,TIGRE,3
cap roscavel pvc tigre,16.9,conexoes,TIGRE,3
luva esgoto pvc correr serie reforcada tigre,99.9,conexoes,TIGRE,3
luva de correr roscavel pvc polegadas tigreluva de correr roscavel pvc polegadas tigre,59.9,conexoes,TIGRE,3
joelho roscavel pvc g bucha latao tigre,29.9,conexoes,TIGRE,3
joelho reducao pvc g soldavel tigre,6.89,conexoes,TIGRE,3
te esgoto pvc tigre,49.9,conexoes,TIGRE,3
juncao esgoto pvc invertida tigre,20.39,conexoes,TIGRE,3
luva de esgoto de correr pvc serie r tigre,32.9,conexoes,TIGRE,3
adaptador pvc saida para bacia sanitaria tigre,63.9,conexoes,TIGRE,3
joelho roscavel pvc g tigre,41.9,conexoes,TIGRE,3
adaptador rosavel com anel para caixa d agua polegadas tigre,124.9,conexoes,TIGRE,3
luva de correr roscavel pvc polegadas tigre,53.9,conexoes,TIGRE,3
cruzeta soldavel em pvc tigre,36.59,conexoes,TIGRE,3
curva soldavel pvc graus tigre,19.49,conexoes,TIGRE,3
adaptador roscavel pvc caixa d agua anel tigre,39.9,conexoes,TIGRE,3
adaptador roscavel com anel para caixa d agua polegadas tigre,99.9,conexoes,TIGRE,3
luva de correr roscavel pvc polegada tigre,45.9,conexoes,TIGRE,3
luva roscavel pvc correr tigre,88.9,conexoes,TIGRE,3
joelho roscavel pvc graus tigre,39.9,conexoes,TIGRE,3
adaptador soldavel pvc caixa d agua flanges livres tigre,369.9,conexoes,TIGRE,3
curva de transposicao soldavel pvc tigre,8.79,conexoes,TIGRE,3
adaptador rosavel com anel para caixa d agua pvc polegadas tigre,39.9,conexoes,TIGRE,3
curvar de esgoto pvc graus serie r tigre,39.9,conexoes,TIGRE,3
adaptador soldavel pvc para caixa agua com flange livre tigre,329.99,conexoes,TIGRE,3
cap de esgoto pvc serie r tigre,90.69,conexoes,TIGRE,3
adaptador roscavel com anel para caixa d agua pvc polegada tigre,21.9,conexoes,TIGRE,3
te soldavel com rosca na bolsa central pvc tigre,5.89,conexoes,TIGRE,3
bucha de reducao transicao cpvc aquatherm tigre,29.9,conexoes,TIGRE,3
juncao esgoto pvc simples tigre,3.79,conexoes,TIGRE,3
uniao soldavel pvc tigre,165.9,conexoes,TIGRE,3
te misturador transicao cpvc aquatherm tigre,34.39,conexoes,TIGRE,3
te transicao cpvc polegada aquatherm tigre,16.9,conexoes,TIGRE,3
te soldavel com rosca de latao na bolsa central pvc tigre,8.9,conexoes,TIGRE,3
luva de transicao cpvc polegada aquatherm tigre,10.9,conexoes,TIGRE,3
bucha reducao pvc soldavel longa tigre,21.9,conexoes,TIGRE,3
bucha de reducao pvc soldavel longa tigre,14.9,conexoes,TIGRE,3
cap roscavel pvc aquartherm tigre,1.65,conexoes,TIGRE,3
bucha reducao transicao cpvc aquatherm tigre,1.15,conexoes,TIGRE,3
te misturador soldavel cpvc aquatherm tigre,8.99,conexoes,TIGRE,3
cap soldavel pvc tigre,66.49,conexoes,TIGRE,3
te de reducao pvc serie reforcada tigre,113.9,conexoes,TIGRE,3
luva soldavel pvc correr tigre,45.9,conexoes,TIGRE,3
bucha reducao pvc roscavel tigre,21.9,conexoes,TIGRE,3
uniao roscavel pvc tigre,83.9,conexoes,TIGRE,3
adaptador soldavel pvc caixa d agua anel tigre,24.49,conexoes,TIGRE,3
bucha reducao pvc soldavel curta tigre,23.59,conexoes,TIGRE,3
te pvc dnmm demm pba junta elastica bbb tigre,176.9,conexoes,TIGRE,3
luva de correr pba pvc dnmm demm je tigre,26.99,conexoes,TIGRE,3
te pvc dnmm demm pba je bbb tigre,97.79,conexoes,TIGRE,3
curva pba pvc dn demm g junta elastica tigre,199.9,conexoes,TIGRE,3
te de esgoto pvc serie reforcada tigre,35.9,conexoes,TIGRE,3
curva pba pvc dnmm demm graus je tigre,29.9,conexoes,TIGRE,3
bucha de reducao soldavel curto pvc tigre,102.9,conexoes,TIGRE,3
luva esgoto pvc simples tigre,2.59,conexoes,TIGRE,3
te de reducao pvc esgoto tigre,11.89,conexoes,TIGRE,3
te reducao pvc esgoto tigre,14.9,conexoes,TIGRE,3
adaptador soldavel de pvc caixa d agua anel tigre,36.39,conexoes,TIGRE,3
curva de esgoto pvc graus serie r tigre,34.9,conexoes,TIGRE,3
te de reducao pvc roscavel tigre,12.49,conexoes,TIGRE,3
te soldavel pvc tigre,9.9,conexoes,TIGRE,3
te de reducao roscavel tigre,29.99,conexoes,TIGRE,3
luva soldavel com bucha de latao pvc tigre,6.75,conexoes,TIGRE,3
luva soldavel pvc tigre,16.99,conexoes,TIGRE,3
luva soldavel pvc de correr tigre,15.69,conexoes,TIGRE,3
luva esgoto pvc correr tigre,43.9,conexoes,TIGRE,3
luva roscavel pvc tigre,1.99,conexoes,TIGRE,3
luva esgoto pvc simples serie reforcada tigre,11.9,conexoes,TIGRE,3
luva reducao pvc roscavel tigre,5.39,conexoes,TIGRE,3
joelho soldavel com rosca pvc graus tigre,5.89,conexoes,TIGRE,3
joelho esgoto pvc g serie reforcada tigre,18.9,conexoes,TIGRE,3
juncao reducao esgoto pvc simples tigre,13.39,conexoes,TIGRE,3
joelho de esgoto pvc graus serie r tigre,26.49,conexoes,TIGRE,3
joelho soldavel com bucha de latao pvc graus tigre,5.75,conexoes,TIGRE,3
juncao para pvc simples serie reforcada ref tigre,73.49,conexoes,TIGRE,3
te roscavel pvc tigre,4.89,conexoes,TIGRE,3
joelho esgoto pvc g com visita tigre,18.9,conexoes,TIGRE,3
curva de esgoto pvc serie r tigre,10.9,conexoes,TIGRE,3
joelho esgoto pvc graus tigre,1.89,conexoes,TIGRE,3
curva esgoto pvc g longa serie normal tigre,54.89,conexoes,TIGRE,3
cap pba pvc dnmm demm je tigre,37.99,conexoes,TIGRE,3
porcelanato calacatta gold acetinado retificado tipo a elizabeth,117.9,porcelanatos,ELIZABETH,9
piso esmaltado parquet brilhante tipo a incenor,27.9,pisos,INCENOR,8
porcelanato georgia bege cetim acetinado retificado tipo a incesa,79.9,porcelanatos,INCESA,9
porcelanato esmaltado hd fior di bosco acetinado tipo a elizabeth,99.9,porcelanatos,ELIZABETH,9
porcelanato travertino bege cetim acetinado retificado tipo a incesa,79.9,porcelanatos,INCESA,9
porcelanato capim dourado acetinado retificado tipo a elizabeth,119.9,porcelanatos,ELIZABETH,9
porcelanato tenerife natural externo retificado tipo a incesa,89.9,porcelanatos,INCESA,9
porcelanato travertino bege externo retificado tipo a incesa,79.9,porcelanatos,INCESA,9
porcelanato calacatta gold polido retificado tipo a elizabeth,139.9,porcelanatos,ELIZABETH,9
porcelanato tenerife natural cetim acetinado retificado tipo a incesa,84.9,porcelanatos,INCESA,9
porcelanato urutu acetinado retificado tipo a elizabeth,119.9,porcelanatos,ELIZABETH,9
porcelanato ibiza branco cetim acetinado retificado tipo a incesa,82.9,porcelanatos,INCESA,9
porcelanato etna gray ext retificado tipo a incesa,89.9,porcelanatos,INCESA,9
porcelanato habitar nebbia cetim acetinado retificado tipo a incesa,79.9,porcelanatos,INCESA,9
porcelanato habitar cinza cetim acetinado retificado tipo a incesa,79.9,porcelanatos,INCESA,9
porcelanato detroit gray ext retificado tipo a incesa,89.9,porcelanatos,INCESA,9
porcelanato essence cinza polido retificado tipo a incesa,97.9,porcelanatos,INCESA,9
porcelanato georgia bege externo retificado tipo a incesa,79.9,porcelanatos,INCESA,9
porcelanato dream polido retificado tipo a incesa,97.9,porcelanatos,INCESA,9
porcelanato essence bege cetim acetinado retificado tipo a incesa,85.9,porcelanatos,INCESA,9
porcelanato ibiza branco polido retificado tipo a incesa,97.9,porcelanatos,INCESA,9
porcelanato evora cetim acetinado retificado tipo a incesa,85.9,porcelanatos,INCESA,9
porcelanato detroit gray cetim acetinado retificado tipo a incesa,89.9,porcelanatos,INCESA,9
porcelanato montreal grafite polido retificado tipo a incesa,99.9,porcelanatos,INCESA,9
porcelanato habitar cinza externo retificado tipo a incesa,79.9,porcelanatos,INCESA,9
porcelanato chicago nebbia satin acetinado retificado tipo a biancogres,85.9,porcelanatos,BIANCOGRES,9
porcelanato dream cetim acetinado retificado tipo a incesa,87.9,porcelanatos,INCESA,9
porcelanato montreal bege polido retificado tipo a incesa,99.9,porcelanatos,INCESA,9
porcelanato aramis white polido retificado tipo a incesa,149.9,porcelanatos,INCESA,9
porcelanato detroit white acetinado retificado tipo a incesa,89.9,porcelanatos,INCESA,9
porcelanato montreal cinza polido retificado tipo a incesa,99.9,porcelanatos,INCESA,9
porcelanato habitar grafite externo retificado tipo a incesa,79.9,porcelanatos,INCESA,9
porcelanato mirage cetim acetinado retificado tipo a incesa,89.9,porcelanatos,INCESA,9
porcelanato essence cinza cetim acetinado retificado tipo a incesa,86.9,porcelanatos,INCESA,9
porcelanato essence bege polido retificado tipo a incesa,99.9,porcelanatos,INCESA,9
porcelanato habitar grafite cetim acetinado retificado tipo a incesa,89.9,porcelanatos,INCESA,9
porcelanato chicago avorio satin acetinado retificado tipo a biancogres,85.9,porcelanatos,BIANCOGRES,9
porcelanato chicago grigio satin acetinado retificado tipo a biancogres,85.9,porcelanatos,BIANCOGRES,9
piso ceramico geranio lux brilhante tipo a arielle,37.9,pisos,ARIELLE,8
piso ceramico riviera branco brilhante tipo a arielle,34.9,pisos,ARIELLE,8
piso ceramico anturio bege brilhante tipo a arielle,38.9,pisos,ARIELLE,8
porcelanato chicago grafite externo retificado tipo a biancogres,85.9,porcelanatos,BIANCOGRES,9
piso araguari brilhante tipo a elizabeth,39.9,pisos,ELIZABETH,8
piso ceramico clivia mre acetinado tipo a arielle,37.9,pisos,ARIELLE,8
piso ceramico travertino tivoli branco brilhante tipo a pointer,31.9,pisos,POINTER,8
piso ceramico travertino tivoli bege brilhante tipo a pointer,32.9,pisos,POINTER,8
porcelanato chicago grigio externo retificado tipo a biancogres,97.9,porcelanatos,BIANCOGRES,9
porcelanato chicago grafite satin acetinado retificado tipo a biancogres,85.9,porcelanatos,BIANCOGRES,9
piso vinilico parma acetinado bege biancogres,88.9,pisos,BIANCOGRES,8
piso vinilico nogueira hd marrom vinilforte,99.9,pisos,VINILFORTE,8
porcelanato marmo polido tipo a pamesa,74.9,porcelanatos,PAMESA,9
piso vinilico copaiba relevo hd marrom vinilforte,99.9,pisos,VINILFORTE,8
piso ceramico rotterdan polido tipo a fioranno,86.9,pisos,FIORANNO,8
porcelanato champagne polido tipo a pamesa,67.9,porcelanatos,PAMESA,9
piso ceramico pituba acetinado tipo c incenor,33.9,pisos,INCENOR,8
piso ceramico algarve polido tipo a fioranno,84.9,pisos,FIORANNO,8
piso vinilico oliveira hd marrom vinilforte,99.9,pisos,VINILFORTE,8
piso vinilico pitangueira hd marrom vinilforte,99.9,pisos,VINILFORTE,8
piso vinilico ferrara acetinado marrom biancogres,88.9,pisos,BIANCOGRES,8
porcelanato marmo calacata polido tipo a incesa,99.9,porcelanatos,INCESA,9
porcelanato esmaltado marcelo acetinado tipo a tecnogres ptgr,69.9,porcelanatos,TECNOGRES,9
porcelanato cumaru beige acetinado tipo a biancogres,103.9,porcelanatos,BIANCOGRES,9
porcelanato esmaltado marcelo granilhado tipo a tecnogres ptgr,69.9,porcelanatos,TECNOGRES,9
porcelanato dunne gray acetinado tipo a incesa,89.9,porcelanatos,INCESA,9
porcelanato versalhes beige satin acetinado tipo a biancogres,107.9,porcelanatos,BIANCOGRES,9
porcelanato osaka white mate tipo a pamesa,87.9,porcelanatos,PAMESA,9
porcelanato imperador ivory polido tipo a pamesa,99.9,porcelanatos,PAMESA,9
porcelanato versalhes beige satin externo tipo a biancogres,107.9,porcelanatos,BIANCOGRES,9
porcelanato nogueira natural acetinado tipo a incesa,89.9,porcelanatos,INCESA,9
porcelanato deck villaggio externo tipo a biancogres,75.9,porcelanatos,BIANCOGRES,9
piso napoli cinza brilhante tipo a incesa,26.9,pisos,INCESA,8
porcelanato safira natural mate tipo a pamesa,94.9,porcelanatos,PAMESA,9
porcelanato esmaltado alexandre acetinado tipo a tecnogres,65.9,porcelanatos,TECNOGRES,9
porcelanato limestone grey mate tipo a pamesa,94.9,porcelanatos,PAMESA,9
piso ceramico pituba acetinado tipo a incenor,46.9,pisos,INCENOR,8
porcelanato esmaltado claudio polido tipo a tecnogres,89.9,porcelanatos,TECNOGRES,9
porcelanato venato dark acetinado tipo a pamesa,99.9,porcelanatos,PAMESA,9
porcelanato solo ferro mate tipo a pamesa,99.9,porcelanatos,PAMESA,9
piso ceramico boa viagem acetinado tipo a incenor,46.9,pisos,INCENOR,8
porcelanato esmaltado augusto acetinado tipo a tecnogres,79.9,porcelanatos,TECNOGRES,9
porcelanato esmaltado flavio acetinado tipo a tecnogres ptgr,69.9,porcelanatos,TECNOGRES,9
porcelanato esmaltado ricardo acetinado tipo a tecnogres,65.9,porcelanatos,TECNOGRES,9
porcelanato esmaltado alexandre polido tipo a tecnogres,89.9,porcelanatos,TECNOGRES,9
piso ceramico itapua acetinado tipo a incenor,46.9,pisos,INCENOR,8
piso ceramico ondina acetinado tipo a incenor,46.9,pisos,INCENOR,8
porcelanato esmaltado julio cesar polido tipo a tecnogres,89.9,porcelanatos,TECNOGRES,9
piso ceramico boa vista acetinado tipo a incenor,46.9,pisos,INCENOR,8
porcelanato limestone white mate tipo a pamesa,99.9,porcelanatos,PAMESA,9
porcelanato esmaltado marcelo polido tipo a tecnogres,89.9,porcelanatos,TECNOGRES,9
porcelanato imperador ivory mate tipo a pamesa,94.9,porcelanatos,PAMESA,9
porcelanato navona classico acetinado tipo a pamesa,97.9,porcelanatos,PAMESA,9
piso ceramico recreio acetinado tipo a incenor,46.9,pisos,INCENOR,8
porcelanato esmaltado adriano acetinado tipo a tecnogres,69.9,porcelanatos,TECNOGRES,9
porcelanato solo calcario mate tipo a pamesa,99.9,porcelanatos,PAMESA,9
piso ceramico jaqueira polido tipo a incenor,67.9,pisos,INCENOR,8
piso ceramico casper mre tipo a arielle,32.9,pisos,ARIELLE,8
piso ceramico riviera branco mate acetinado tipo a arielle,37.9,pisos,ARIELLE,8
piso ceramico pituba polido tipo a incenor,67.9,pisos,INCENOR,8
piso ceramico preston mre tipo a arielle,32.9,pisos,ARIELLE,8
piso ceramico miami gray brilhante tipo a arielle,34.9,pisos,ARIELLE,8
piso ceramico morro branco brilhante tipo a incenorr,32.9,pisos,INCENOR,8
piso ceramico milagres brilhante tipo a incenorr,36.9,pisos,INCENOR,8
piso ceramico serido acetinado tipo a incenorr,36.9,pisos,INCENOR,8
piso ceramico miami beige brilhante tipo a arielle,34.9,pisos,ARIELLE,8
piso ceramico baia dos golfinhos polido tipo a incenor,56.9,pisos,INCENOR,8
piso ceramico porto seguro acetinado tipo a incenorr,34.9,pisos,INCENOR,8
piso ceramico lacerda brilhante tipo a incenorr,36.9,pisos,INCENOR,8
porcelanato esmaltado nepos polido tipo a tecnogres,85.9,porcelanatos,TECNOGRES,9
porcelanato wave bege brilhante retificado tipo a pamesa,49.9,porcelanatos,PAMESA,9
piso ceramico verbena acetinado tipo a arielle,38.9,pisos,ARIELLE,8
piso ceramico ondina polido tipo a incenor,67.9,pisos,INCENOR,8
piso ceramico narciso mre tipo a arielle,38.9,pisos,ARIELLE,8
piso ceramico clube social brilhante tipo a pointer,29.9,pisos,POINTER,8
piso ceramico lirio lux brilhante tipo a arielle,37.9,pisos,ARIELLE,8
piso ceramico iris lux brilhante tipo a arielle,37.9,pisos,ARIELLE,8
piso ceramico geranio mate acetinado tipo a arielle,37.9,pisos,ARIELLE,8
porcelanato royal black lux polido tipo a biancogres,279.9,porcelanatos,BIANCOGRES,9
piso ceramico anturio cinza brilhante tipo a arielle,38.9,pisos,ARIELLE,8
piso ceramico duomo branco brilhante tipo a incesa,27.9,pisos,INCESA,8
piso ceramico amarilis brilhante tipo a arielle,37.9,pisos,ARIELLE,8
porcelanato marmo gold polido tipo a incesa,99.9,porcelanatos,INCESA,9
piso ceramico laredo acetinado tipo a arielle,37.9,pisos,ARIELLE,8
piso ceramico cravo acetinado tipo a arielle,37.9,pisos,ARIELLE,8
piso ceramico gales bege brilhante tipo a incesa,27.9,pisos,INCESA,8
porcelanato amazonita real lux polido tipo a biancogres,289.9,porcelanatos,BIANCOGRES,9
piso ceramico calla brilhante tipo a arielle,37.9,pisos,ARIELLE,8
porcelanato calacata oro lux polido tipo a biancogres,279.9,porcelanatos,BIANCOGRES,9
piso ceramico ivy madeira mre tipo a arielle,37.9,pisos,ARIELLE,8
porcelanato dream polido tipo a incesa,99.9,porcelanatos,INCESA,9
porcelanato teca natural acetinado tipo a biancogres,103.9,porcelanatos,BIANCOGRES,9
piso ceramico clube social brilhante tipo c pointer,27.9,pisos,POINTER,8
porcelanato donatello acetinado tipo a biancogres,97.9,porcelanatos,BIANCOGRES,9
piso esmaltado maragogi brilhante tipo a incenorr,34.9,pisos,INCENOR,8
porcelanato elementi grigio externo acetinado tipo a biancogres,99.9,porcelanatos,BIANCOGRES,9
porcelanato elementi grigio santi acetinado tipo a biancogres,99.9,porcelanatos,BIANCOGRES,9
piso esmaltado sergipe brilhante tipo a incenorr,36.9,pisos,INCENOR,8
piso ppi r polido retificado tipo a incenor,56.9,pisos,INCENOR,8
porcelanato onice crema lux polido tipo a biancogres,168.9,porcelanatos,BIANCOGRES,9
piso esmaltado recife antigo acetinado tipo a incenorr,36.9,pisos,INCENOR,8
porcelanato elementi grigio deco acetinado tipo a biancogres,75.9,porcelanatos,BIANCOGRES,9
porcelanato calacata oro satin acetinado tipo a biancogres,98.9,porcelanatos,BIANCOGRES,9
porcelanato esmaltado imperial branco polido tipo a elizabeth,119.9,porcelanatos,ELIZABETH,9
piso esmaltado alagoas acetinado tipo a incenorr,34.9,pisos,INCENOR,8
piso ceramico bourbon brown mate tipo a pointer,78.9,pisos,POINTER,8
piso ceramico vizcaya polido tipo a pointer,129.9,pisos,POINTER,8
piso ceramico bourbon reddish mate tipo a pointer,99.9,pisos,POINTER,8
piso ceramico pietra valencia blanco polido tipo a pointer,129.9,pisos,POINTER,8
piso ceramico over cement snow mate tipo a pointer,89.9,pisos,POINTER,8
piso ceramico pietra valencia gris polido tipo a pointer,129.9,pisos,POINTER,8
piso ceramico avelana castanho mate tipo a pointer,89.9,pisos,POINTER,8
piso ceramico avelana castanho externo tipo a pointer,89.9,pisos,POINTER,8
porcelanato paviment white acetinado tipo a incesa,69.9,porcelanatos,INCESA,9
porcelanato ipe inside acetinado tipo a incesa,89.9,porcelanatos,INCESA,9
porcelanato cemento nebbia acetinado tipo a biancogres,75.9,porcelanatos,BIANCOGRES,9
porcelanato olimpo white cetim acetinado tipo a incesa,89.9,porcelanatos,INCESA,9
piso ceramico esmaltado itaunas bege acetinado tipo a elizabeth,32.9,pisos,ELIZABETH,8
porcelanato cemento grafite acetinado tipo a biancogres,104.9,porcelanatos,BIANCOGRES,9
porcelanato carvalho natural externo tipo a biancogres,99.9,porcelanatos,BIANCOGRES,9
porcelanato olimpo white polido tipo a incesa,109.9,porcelanatos,INCESA,9
porcelanato cemento grafite externo tipo a biancogres,75.9,porcelanatos,BIANCOGRES,9
porcelanato tunisia polido tipo a incesa,109.0,porcelanatos,INCESA,9
piso vinilico cemento grigio acetinado tipo a biancogres,149.9,pisos,BIANCOGRES,8
piso esmaltado hd coqueirinho rustico tipo a elizabeth,33.9,pisos,ELIZABETH,8
piso esmaltado hd sao francisco brilhante tipo a elizabeth,32.9,pisos,ELIZABETH,8
piso cristalato ceramico albury acetinado tipo a branco cecafi,59.9,pisos,CECAFI,8
piso cristalato ceramico oceane acetinado tipo a bege cecafi,69.9,pisos,CECAFI,8
porcelanato quatzita antiderrapante tipo a ouro pamesa,56.9,porcelanatos,PAMESA,9
piso cristalato ceramico venezia polido tipo a branco fioranno,79.9,pisos,FIORANNO,8
piso esmaltado hd maranhao brilhante tipo a elizabeth,31.9,pisos,ELIZABETH,8
