name,price,category,brand,target
tinta spray uso geral branco fosco chemicolor,19.9,tintas,CHEMICOLOR,10
tinta spray metalica vermelho chemicolor,25.9,tintas,CHEMICOLOR,10
tinta spray uso geral aluminio roda chemicolor,19.9,tintas,CHEMICOLOR,10
tinta spray uso geral cinza escuro chemicolor,19.9,tintas,CHEMICOLOR,10
tinta spray metalica azul chemicolor,25.9,tintas,CHEMICOLOR,10
tinta spray uso geral cinza claro chemicolor,19.9,tintas,CHEMICOLOR,10
tinta spray luminosa pink chemicolor,34.9,tintas,CHEMICOLOR,10
tinta spray uso geral amarelo chemicolor,19.9,tintas,CHEMICOLOR,10
tinta spray uso geral azul escuro chemicolor,19.9,tintas,CHEMICOLOR,10
tinta spray luminosa verde chemicolor,34.9,tintas,CHEMICOLOR,10
tinta spray uso geral azul claro chemicolor,19.9,tintas,CHEMICOLOR,10
tinta spray uso geral dourado chemicolor,24.9,tintas,CHEMICOLOR,10
tinta spray metalica verde chemicolor,25.9,tintas,CHEMICOLOR,10
tinta spray luminosa amarelo chemicolor,34.9,tintas,CHEMICOLOR,10
tinta spray metalica dourado chemicolor,25.9,tintas,CHEMICOLOR,10
adesivo instantaneo g super bonder power flex gel henkel,7.9,complementos,HENKEL,2
fita vhb dupla face de adesivo transferivel mmxm flow pack,99.9,complementos,3M,2
resina acrilica brilhante transparente coral,229.9,complementos,CORAL,2
tinta acrilica fosca pinta piso vermelho seguranca coral,369.9,tintas,CORAL,10
tinta acrilica semibrilho coralar mais brilho e protecao coral,299.9,tintas,CORAL,10
tinta acrilica acetinado decora seda branco gelo coral,699.9,tintas,CORAL,10
thinner ecoeficiente solvente incolor anjo,155.9,complementos,ANJO,2
fita crepe uso geral sanfona mmxm norton,16.9,complementos,NORTON,2
tinta acrilica decora seda acetinado branco gelo coral,199.9,tintas,CORAL,10
tinta acrilica decora seda acetinado branca coral,189.9,tintas,CORAL,10
hidrofugante para fachada w quartzolit,438.9,complementos,QUARTZOLIT,2
diluente aguarras incolor coral,39.9,complementos,CORAL,2
tinta acrilica fosca coralar mais desempenho branco gelo coral,69.9,tintas,CORAL,10
tinta base litros p dialine base agua iquine,148.9,tintas,IQUINE,10
adesivo silicone spray loctite,28.9,complementos,LOCTITE,2
tinta acrilica foca diatex pinta mais litros guarana iquine,54.9,tintas,IQUINE,10
adesivo inst g super bonder pincel henk,17.9,complementos,HENKEL,2
adesivo silicone g flexite neutro incolor cascola henkel,108.9,complementos,HENKEL,2
anticorrosivo protetor anti rust allchem,69.9,complementos,ALLCHEM QUIMICA,2
tinta acrilica fosca litros coralar mais economico braco coral,49.9,tintas,CORAL,10
tinta acrilica fosca delanil rende muito litros riviera iquine,89.9,tintas,IQUINE,10
tinta epoxi renova azulejos & muito mais brilhante branco coral,349.9,complementos,CORAL,2
tinta acrilica fosca litros coralar mais economico branco gelo coral,49.9,tintas,CORAL,10
diluente aguarras coral,172.9,complementos,CORAL,2
tinta acrilica fosca coralar mais resistente marfim coral,99.9,tintas,CORAL,10
tinta acrilica fosca coralar mais resistente branco coral,99.9,tintas,CORAL,10
tinta acrilica fosca coralar duo rubi coral,49.9,tintas,CORAL,10
tinta esmalte hammerite direto na ferrugem litros vermelho coral,189.9,tintas,CORAL,10
fita silver tape mmxm prata norton,12.9,complementos,NORTON,2
tinta acrilica fosca coralar mais resistente amarelo frevo coral,319.9,tintas,CORAL,10
tinta acrilica fosca coralar mais resistente branco gelo coral,319.9,tintas,CORAL,10
fita crepe automotiva premium mmxm norton,6.9,complementos,NORTON,2
tinta betum litros neutrol acqua base agua vedacit,769.9,complementos,VEDACIT,2
fita dupla face mmxm espuma branca norton,12.9,complementos,NORTON,2
tinta asfaltica impermeabilizante neutrol a base de agua preto vedacit,199.9,complementos,VEDACIT,2
tinta esmalte sintetico brilhante hammerite premium ouro litros coral,219.9,tintas,CORAL,10
fita adesiva silver tape norton,22.9,complementos,NORTON,2
tinta esmalte sintetico brilhante hammerite ouro coral,99.9,tintas,CORAL,10
tinta acrilica fosca coralar duo rubi litros coral,199.9,tintas,CORAL,10
tinta esmalte brilho gll coralit transparente coral,189.9,tintas,CORAL,10
adesivo de contato power crystal g transparente loctite,19.9,complementos,HENKEL,2
tinta esmalte alto brilho dialine base agua branco gelo iquine,158.9,tintas,IQUINE,10
tinta esmalte alto brilho dialine base agua azul del rey iquine,44.9,tintas,IQUINE,10
tinta esmalte alto brilho dialine base agua preto iquine,44.9,tintas,IQUINE,10
tinta esmalte alto brilho dialine base agua marfim iquine,158.9,tintas,IQUINE,10
tinta esmalte alto brilho dialine base agua marrom tabaco iquine,44.9,tintas,IQUINE,10
tinta esmalte alto brilho dialine base agua verde folha iquine,44.9,tintas,IQUINE,10
tinta esmalte alto brilho dialine base agua branco neve iquine,44.9,tintas,IQUINE,10
tinta esmalte alto brilho dialine base agua platina iquine,44.9,tintas,IQUINE,10
tinta esmalte alto brilho dialine base agua vermelho iquine,44.9,tintas,IQUINE,10
tinta esmalte alto brilho dialine base agua amarelo iquine,44.9,tintas,IQUINE,10
tinta esmalte alto brilho dialine base agua laranja iquine,44.9,tintas,IQUINE,10
tinta esmalte alto brilho dialine base agua cinza medio iquine,44.9,tintas,IQUINE,10
tinta acrilica fosca acaba com o mofo branco neve iquine,72.9,tintas,IQUINE,10
tinta esmalte epoxi catalisavel wandepoxy base solvente cinza medio coral,359.9,complementos,CORAL,2
tinta acrilica fosca acaba com o mofo branco gelo iquine,72.9,tintas,IQUINE,10
esmalte epoxi catalisavel brilhante wandepoxy base solvente branco coral,399.9,complementos,CORAL,2
catalizador wandepoxy parte b amida coral,134.9,complementos,CORAL,2
catalizador wandepoxy parte b amina coral,128.9,complementos,CORAL,2
adesivo pulvi vinil g incolor pulvitec,11.9,complementos,PULVITEC,2
adesivo de contato g polyplac pulvitec,11.9,complementos,PULVITEC,2
diluente para epoxi wandepoxy coral,349.9,complementos,CORAL,2
esmalte epoxi catalisavel brilhante wandepoxy base solvente amarelo coral,359.9,complementos,CORAL,2
tinta esmalte sintetico brilhante coralit antiferrugem branco coral,209.9,tintas,CORAL,10
tinta esmalte sintetico alto brilho coralit ultra resistencia ouro coral,319.9,tintas,CORAL,10
adesivo litro chapix quartzolit,39.9,complementos,QUARTZOLIT,2
tinta esmalte sintetico brilhante coralit antiferrugem cinza coral,64.9,tintas,CORAL,10
tinta esmalte sintetico brilhante coralit antiferrugem preto coral,219.9,tintas,CORAL,10
adesivo litros chapix quartzolit,329.9,complementos,QUARTZOLIT,2
tinta esmalte sintetico brilhante coralit ultra resistencia ouro coral coral,56.9,tintas,CORAL,10
tinta esmalte sintetico brilhante coralit ultra resistencia ouro coral,34.9,tintas,CORAL,10
verniz maritimo litros iquine,169.9,complementos,IQUINE,2
fundo nivelador fosco complementos para madeira branco iquine,129.9,complementos,IQUINE,2
tinta acrilica diatex pinta mais litros ipanema iquine,54.9,tintas,IQUINE,10
verniz alto brilho extrarrapido cedro iquine,36.9,complementos,IQUINE,2
verniz alto brilho extrarrapido citin iquine,39.9,complementos,IQUINE,2
tinta acrilica diatex pinta mais maracuja iquine,54.9,tintas,IQUINE,10
verniz maritimo incolor iquine,52.9,complementos,IQUINE,2
tinta acrilica fosca delanil rende muito retangular branco neve iquine,209.9,tintas,IQUINE,10
solvente incolor iquine,27.9,complementos,IQUINE,2
fundo preparador fosco incolor iquine,99.9,complementos,IQUINE,2
tinta esmalte sintetico brilhante coralar preto coral,29.9,tintas,CORAL,10
tinta esmalte sintetico brilhante coralar azul del rey coral,99.9,tintas,CORAL,10
tinta esmalte sintetico brilhante coralar verde folha coral,29.9,tintas,CORAL,10
tinta esmalte sintetico brilhante coralar branco coral,88.9,tintas,CORAL,10
tinta esmalte sintetico brilhante coralar branco gelo coral,29.9,tintas,CORAL,10
tinta esmalte sintetico brilhante coralar amarelo coral,99.9,tintas,CORAL,10
verniz fosco litros cetol stain base agua beleza natural sparlack,269.9,complementos,SPARLACK,2
tinta esmalte sintetico brilhante coralar cinza escuro coral,99.9,tintas,CORAL,10
verniz fosco cetol stain base agua beleza natural sparlack,84.9,complementos,SPARLACK,2
tinta esmalte sintetico brilhante coralar vermelho coral,99.9,tintas,CORAL,10
verniz extra maritimo acetinado sparlack base agua natural coral,169.9,complementos,SPARLACK,2
verniz brilhante extra maritimo base agua natural sparlack,159.9,complementos,SPARLACK,2
verniz acetinado cetol efeito natural base agua sparlack,69.9,complementos,SPARLACK,2
tinta acrilica eggshell protecao sol e chuva pintura impermeabilizante branco coral,199.9,tintas,CORAL,10
verniz acetinado cetol stain sparlack base agua imbuia coral,228.9,complementos,SPARLACK,2
verniz acetinado cetol stain base agua mogno sparlack,228.9,complementos,SPARLACK,2
verniz brilhante extra maritimo base agua natural coral,46.9,complementos,SPARLACK,2
verniz maritimo acetinado base agua sparlack premium incolor coral,49.9,complementos,SPARLACK,2
verniz acetinado cetol efeito natural base agua litros sparlack,239.9,complementos,SPARLACK,2
tinta esmalte sintetico brilhante coralit total verde folha coral,189.9,tintas,CORAL,10
resina multiuso incolor hydronorth,69.9,complementos,HYDRONORTH,2
fundo sintetico anticorrosivo zarcofer oxido iquine,139.9,complementos,IQUINE,2
tinta esmalte sintetico brilhante coralit total tabaco coral,189.9,tintas,CORAL,10
verniz semibrilho cetol deck antideslizante sparlack incolor coral,399.9,complementos,SPARLACK,2
resina multiuso litros incolor hydronorth,249.9,complementos,HYDRONORTH,2
tinta acrilica diatex pinta mais rio ostras iquine,54.9,tintas,IQUINE,10
tinta acrilica fosca renova tetos branco coral,49.9,tintas,CORAL,10
verniz brilhante litros neutrex imbuia sparlack,158.9,complementos,SPARLACK,2
verniz brilhante neutrex imbuia sparlack,44.9,complementos,CORAL,2
tinta vinil acrilica fosco aveludado litros pintalar pitanga iquine,42.9,tintas,IQUINE,10
tinta acrilica diatex pinta mais litros hortela iquine,54.9,tintas,IQUINE,10
tinta acrilica diatex pinta mais camarao iquine,54.9,tintas,IQUINE,10
tinta acrilica fosca coralar mais desempenho rubi coral,69.9,tintas,CORAL,10
tinta esmalte sintetico brilhante coralit secagem rapida platina coral,46.9,tintas,CORAL,10
tinta acrilica fosca coralar mais desempenho verde kiwi coral,229.9,tintas,CORAL,10
tinta esmalte brilhante coralit secagem rapida tabaco litros coral,129.9,tintas,CORAL,10
tinta esmalte sintetico brilhante coralit secagem rapida tabaco coral,46.9,tintas,CORAL,10
tinta acrilica fosca coralar mais desempenho laranja maracatu coral,69.9,tintas,CORAL,10
tinta acrilica fosca coralar mais desempenho oceano coral,229.9,tintas,CORAL,10
tinta acrilica fosca coralar mais desempenho pavao coral,69.9,tintas,CORAL,10
tinta esmalte sintetico brilhante coralit secagem rapida verde folha coral,46.9,tintas,CORAL,10
tinta esmalte sintetico brilhante coralit secagem rapida laranja coral,46.9,tintas,CORAL,10
tinta esmalte sintetico brilhante coralit secagem rapida colorado coral,46.9,tintas,CORAL,10
tinta esmalte sintetico brilhante coralit secagem rapida vermelho goya coral,46.9,tintas,CORAL,10
tinta acrilica fosca coralar mais desempenho lua do sertao coral,69.9,tintas,CORAL,10
tinta esmalte sintetico brilhante coralit secagem rapida azul mar coral,46.9,tintas,CORAL,10
tinta acrilica fosca coralar mais desempenho verde timbalada coral,69.9,tintas,CORAL,10
tinta esmalte sintetico brilhante coralit secagem rapida vermelho coral,46.9,tintas,CORAL,10
tinta esmalte brilhante coralit secagem rapida amarelo litros coral,129.9,tintas,CORAL,10
tinta esmalte brilhante coralit secagem rapida vermelho goya litros coral,129.9,tintas,CORAL,10
tinta esmalte sintetico brilhante coralit secagem rapida azul franca coral,46.9,tintas,CORAL,10
tinta esmalte brilhante coralit secagem rapida azul mar litros coral,129.9,tintas,CORAL,10
fita dupla face mmxm fixa forte transparente,29.9,complementos,3M,2
fita empacotamento mmxm marrom,11.9,complementos,3M,2
adesivo silicone g alta temperatura polystic vermelho pulvitec,13.9,complementos,PULVITEC,2
fita dupla face mmxm friso,67.9,complementos,3M,2
fita dupla face mmxm t transparente,85.9,complementos,3M,2
fita dupla face scotch mmxm fixa forte transparente,21.9,complementos,3M,2
adesivo contato g cascola tradicional henkel,29.9,complementos,HENKEL,2
tinta esmalte sintetico brilhante coralit total marfim coral,189.9,tintas,CORAL,10
fita dupla face fixa forte,14.9,complementos,3M,2
fita dupla face mmxm friso t transparente,21.9,complementos,3M,2
tinta esmalte litros brilhante coralit secagem rapida branco coral,129.9,tintas,CORAL,10
fita crepe blue tap mmxm azul h,16.9,complementos,3M,2
tinta esmalte brilhante coralit secagem rapida preto litros coral,129.9,tintas,CORAL,10
fita empacotamento mmxm transparente,9.9,complementos,3M,2
verniz acetinado litros cetol ipe sparlack,399.9,complementos,SPARLACK,2
convertedor de ferrugem em alchem,28.9,complementos,ALLCHEM QUIMICA,2
verniz acetinado cetol imbuia,124.9,complementos,SPARLACK,2
verniz acetinado cetol mogno litros sparlack,399.9,complementos,SPARLACK,2
verniz acetinado cetol cedro sparlack,124.9,complementos,SPARLACK,2
verniz brilhante neutrex castanho avermelhado sparlack,44.9,complementos,CORAL,2
verniz acetinado cetol cedro litros sparlack,399.9,complementos,SPARLACK,2
verniz acetinado cetol canela litros sparlack,399.9,complementos,SPARLACK,2
verniz brilhante extra maritimo natural incolor sparlack,19.9,complementos,SPARLACK,2
removedor tira cola madeira plasticos e roupas allchem quimica,26.9,complementos,ALLCHEM QUIMICA,2
verniz brilhante litros neutrex castanho avermelhado sparlack,158.9,complementos,SPARLACK,2
verniz maritimo fosco sparlack premium natural coral,46.9,complementos,SPARLACK,2
verniz extra maritimo fosco sparlack premium natural coral,148.9,complementos,SPARLACK,2
verniz acetinado cetol mogno sparlack,124.9,complementos,CORAL,2
adesivo epoxi poly epox minutos g pulvitec,19.9,complementos,PULVITEC,2
verniz triplo filtro solar acetinado sparlack solgard mogno coral,239.9,complementos,SPARLACK,2
verniz acetinado cetol efeito natural sparlack,69.9,complementos,SPARLACK,2
verniz acetinado cetol canela sparlack,124.9,complementos,SPARLACK,2
verniz brilhante cetol classic ipe coral,124.9,complementos,SPARLACK,2
verniz brilhante cetol classic canela coral,124.9,complementos,SPARLACK,2
verniz brilhante cetol classic litros ipe coral,398.9,complementos,SPARLACK,2
verniz brilhante extra maritimo natural coral,42.9,complementos,SPARLACK,2
verniz semibrilho cetol deck natural litros sparlack,399.9,complementos,SPARLACK,2
verniz acetinado stain natural litros sparlack,209.9,complementos,SPARLACK,2
verniz triplo filtro solar brilhante solgard sparlack mogno coral,209.9,complementos,SPARLACK,2
resina acrilica concentrada litros incolor iquine,749.9,complementos,IQUINE,2
verniz brilhante cetol classic imbuia coral,124.9,complementos,CORAL,2
verniz acetinado cetol imbuia litros sparlack,399.9,complementos,SPARLACK,2
verniz brilhante cetol classic litros mogno coral,398.9,complementos,SPARLACK,2
verniz brilhante cetol classic litros cedro coral,398.9,complementos,SPARLACK,2
verniz brilhante solgard triplo filtro solar mogno coral,62.9,complementos,SPARLACK,2
verniz brilhante cetol classic mogno coral,124.9,complementos,SPARLACK,2
removedor de tinta litros iquine,169.9,complementos,IQUINE,2
verniz brilhante cetol classic litros imbuia coral,398.9,complementos,SPARLACK,2
verniz brilhante cetol classic litros canela coral,398.9,complementos,SPARLACK,2
verniz brilhante cetol classic cedro coral,124.9,complementos,SPARLACK,2
verniz semibrilho cetol deck sparlack natural coral,118.9,complementos,SPARLACK,2
tinta acrilica fosca litros coralar mais economico areia coral,49.9,tintas,CORAL,10
verniz brilhante solgard triplo filtro solar natural coral,59.9,complementos,SPARLACK,2
tinta acrilica semibrilho limpa facil branco iquine,489.9,tintas,IQUINE,10
verniz extra maritimo sparlack premium incolor coral,136.9,complementos,SPARLACK,2
verniz sparlack solgard triplo filtro solar litros natural coral,209.9,complementos,SPARLACK,2
tinta acrilica semibrilho limpa facil perola iquine,489.9,tintas,IQUINE,10
verniz acetinado sparlack solgard natural coral,209.9,complementos,CORAL,2
verniz brilhante neutrex mogno avermelhado sparlack,44.9,complementos,CORAL,2
verniz brilhante litros neutrex mogno avermelhado sparlack,158.9,complementos,SPARLACK,2
tinta acrilica semibrilho limpa facil palha iquine,118.9,tintas,IQUINE,10
tinta esmalte sintetico brilhante coralit total branco coral,159.9,tintas,CORAL,10
tinta acrilica fosca litros coralar mais economico palha coral,49.9,tintas,CORAL,10
tinta esmalte sintetico brilhante coralit total preto coral,189.9,tintas,CORAL,10
tinta esmalte sintetico brilhante coralit total amarelo coral,59.9,tintas,CORAL,10
tinta esmalte sintetico brilhante coralit total vermelho coral,189.9,tintas,CORAL,10
tinta esmalte sintetico brilhante coralit total azul del rey coral,189.9,tintas,CORAL,10
tinta acrilica semibrilho limpa facil branco neve iquine,118.9,tintas,IQUINE,10
tinta acrilica semibrilho limpa facil branco gelo iquine,489.9,tintas,IQUINE,10
tinta esmalte sintetico acetinado coralit total branco gelo coral,52.9,tintas,CORAL,10
tinta esmalte sintetico sintetico acetinado coralit total branco coral,52.9,tintas,CORAL,10
tinta esmalte sintetico brilhante coralit total branco gelo coral,159.9,tintas,CORAL,10
tinta esmalte sintetico brilhante coralit total platina coral,189.9,tintas,CORAL,10
tinta acrilica fosca coralar mais desempenho concreto coral,229.9,tintas,CORAL,10
cola cascola monta e fixa pl exterior g henkel,83.9,complementos,CASCOLA,2
removedor de tintas e vernizes iquine,34.9,complementos,IQUINE,2
tinta esmalte dialine seca rapido vermelho iquine,10.9,tintas,IQUINE,10
tinta acrilica fosca diapiso superresistente litros verde folha iquine,289.9,tintas,IQUINE,10
fita silver tape mmxm scotch,68.9,complementos,3M,2
tinta acrilica fosca diapiso superresistente litros amarelo demarcacao iquine,289.9,tintas,IQUINE,10
tinta esmalte dialine seca rapido azul del rey iquine,10.9,tintas,IQUINE,10
tinta esmalte dialine seca rapido preto iquine,10.9,tintas,IQUINE,10
tinta esmalte dialine seca rapido azul franca iquine,10.9,tintas,IQUINE,10
tinta esmalte dialine seca rapido amarelo iquine,10.9,tintas,IQUINE,10
tinta acrilica fosco diapiso azul profundo iquine,289.9,tintas,IQUINE,10
tinta esmalte litros dialine seca rapido platina iquine,10.9,tintas,IQUINE,10
adesivo silicone g acetico banheiro e cozinha flexite henkel,59.9,complementos,HENKEL,2
tinta esmalte dialine seca rapido cinza medio iquine,10.9,tintas,IQUINE,10
tinta esmalte dialine seca rapido aluminio iquine,10.9,tintas,IQUINE,10
tinta acrilica fosco diapiso ceramica iquine,289.9,tintas,IQUINE,10
tinta esmalte dialine seca rapido laranja iquine,10.9,tintas,IQUINE,10
tinta acrilica fosca delanil rende muito litros avelos iquine,89.9,tintas,IQUINE,10
tinta esmalte dialine seca rapido verde folha iquine,10.9,tintas,IQUINE,10
adesivo epoxi tix ag bg compound vedacit,139.9,complementos,VEDACIT,2
tinta acrilica fosca delanil rende muito litros baia do sancho iquine,89.9,tintas,IQUINE,10
tinta acrilica fosca diapiso superresistente litros concreto iquine,289.9,tintas,IQUINE,10
tinta acrilica fosco diapiso preto iquine,289.9,tintas,IQUINE,10
cola cascola monta e fixa pl g henkel,48.9,complementos,HENKEL,2
tinta acrilica fosco diapiso amarelo demarcacao iquine,78.9,tintas,IQUINE,10
tinta litros acrilica fosco diapiso verde folha iquine,78.9,tintas,IQUINE,10
tinta acrilica fosco diapiso vermelho iquine,24.9,tintas,IQUINE,10
tinta esmalte sintetico brilhante dialine secagem rapida laranja citrico iquine,44.9,tintas,IQUINE,10
tinta acrilica fosca diapiso superresistente litros branco neve iquine,289.9,tintas,IQUINE,10
tinta acrilica fosca diapiso superresistente litros vermelho iquine,289.9,tintas,IQUINE,10
tinta acrilica fosca diapiso preto litros iquine,78.9,tintas,IQUINE,10
tinta acrilica fosco diapiso cinza escuro iquine,78.9,tintas,IQUINE,10
adesivo instantaneo super bonder pincel g loctite,15.9,complementos,HENKEL,2
tinta acrilica fosco diapiso concreto iquine,24.9,tintas,IQUINE,10
tinta acrilica fosco diapiso branco neve iquine,24.9,tintas,IQUINE,10
tinta acrilica fosco diapiso cinza medio iquine,24.9,tintas,IQUINE,10
tinta acrilica fosco diapiso verde folha iquine,24.9,tintas,IQUINE,10
tinta acrilica fosca diapiso superresistente litros cinza medio iquine,289.9,tintas,IQUINE,10
tinta litros acrilica fosco diapiso concreto iquine,78.9,tintas,IQUINE,10
adesivo epoxi g poly hobby seca em horas pulvitec,21.9,complementos,PULVITEC,2
tinta acrilica fosca pinta piso amarelo demarcacao coral,369.9,tintas,CORAL,10
adesivo selante acrilico cascola flexite fendas e trincas g henkel,42.9,complementos,HENKEL,2
tinta acrilica fosca pinta piso branco coral,369.9,tintas,CORAL,10
adesivo de silicone g polystic acetico para uso geral pulvitec,10.9,complementos,PULVITEC,2
fita crepe mmxm uso geral sanfonada norton,6.9,complementos,NORTON,2
tinta acrilica diatex pinta mais litros verde piscina iquine,54.9,tintas,IQUINE,10
tinta acrilica diatex pinta mais litros pessego iquine,54.9,tintas,IQUINE,10
tinta acrilica diatex pinta mais litros perola iquine,54.9,tintas,IQUINE,10
fundo sintetico anticorrosivo zarcofer preto iquine,139.9,complementos,IQUINE,2
tinta esmalte brilho dialine seca rapido branco gelo iquine,15.9,tintas,IQUINE,10
thinner incolor iquine,21.9,complementos,IQUINE,2
tinta esmalte dialine seca rapido branco gelo iquine,10.9,tintas,IQUINE,10
tinta esmalte sintetico brilhante dialine secagem rapida litros vermelho vinho iquine,128.9,tintas,IQUINE,10
tinta esmalte acetinado litros dialine seca rapido branco gelo iquine,152.9,tintas,IQUINE,10
tinta vinil acrilica diatex pinta mais amarelo canario iquine,54.9,tintas,IQUINE,10
tinta esmalte litros dialine seca rapido tabaco iquine,10.9,tintas,IQUINE,10
tinta esmalte acetinado dialine seca rapido branco gelo iquine,38.9,tintas,IQUINE,10
tinta acrilica diatex pinta mais litros marfim iquine,54.9,tintas,IQUINE,10
fundo sintetico anticorrosivo zarcofercinza iquine,38.9,complementos,IQUINE,2
fundo dupla acao ltl zarcofer laranja iquine,36.9,complementos,IQUINE,2
fundo dupla acao litros zarcofer laranja iquine,139.9,complementos,IQUINE,2
tinta acrilica diatex pinta mais litros branco neve iquine,54.9,tintas,IQUINE,10
tinta acrilica diatex pinta mais litros areia iquine,54.9,tintas,IQUINE,10
tinta acrilica diatex pinta mais litros cromo iquine,54.9,tintas,IQUINE,10
tinta acrilica diatex pinta mais litros branco gelo iquine,54.9,tintas,IQUINE,10
tinta esmaltel dialine seca rapido branco neve iquine,10.9,tintas,IQUINE,10
fundo sintetico anticorrosivo zarcofer cinza iquine,139.9,complementos,IQUINE,2
tinta esmalte sintetico brilhante dialine secagem rapida litros platina iquine,135.9,tintas,IQUINE,10
tinta esmalte sintetico brilhante dialine secagem rapida litros creme iquine,135.9,tintas,IQUINE,10
tinta esmalte sintetico brilhante dialine secagem rapida litros branco gelo iquine,135.9,tintas,IQUINE,10
tinta esmalte sintetico brilhante dialine secagem rapida vermelho iquine,44.9,tintas,IQUINE,10
tinta acrilica fosca delanil rende muito litros branco neve iquine,89.9,tintas,IQUINE,10
tinta esmalte sintetico brilhante dialine secagem rapida camurca iquine,44.9,tintas,IQUINE,10
tinta esmalte sintetico brilhante dialine secagem rapida marrom iquine,44.9,tintas,IQUINE,10
tinta esmalte sintetico brilhante dialine secagem rapida marfim iquine,44.9,tintas,IQUINE,10
verniz brilhante copal iquine,32.9,complementos,IQUINE,2
tinta esmalte sintetico brilhante litros dialine secagem rapida camurca iquine,135.9,tintas,IQUINE,10
tinta esmalte sintetico brilhante dialine secagem rapida creme iquine,44.9,tintas,IQUINE,10
fundo galvanizado fosco galvomax branco neve iquine,49.9,complementos,IQUINE,2
tinta acrilica fosca delanil rende muito litros palha iquine,89.9,tintas,IQUINE,10
verniz copal litros incolor iquine,119.9,complementos,IQUINE,2
tinta esmalte sintetico brilhante dialine secagem rapida vermelho vinho iquine,44.9,tintas,IQUINE,10
tinta esmalte dialine seca rapido amarelo cartepillar iquine,128.9,tintas,IQUINE,10
tinta vinil acrilica fosco aveludado litros pintalar pessego iquine,42.9,tintas,IQUINE,10
tinta vinil acrilica fosco aveludado pintalar azul ceu iquine,42.9,tintas,IQUINE,10
diluente aguarras iquine,129.9,complementos,IQUINE,2
tinta esmalte sintetico brilhante dialine secagem rapida amarelo cartepillar iquine,38.9,tintas,IQUINE,10
tinta esmalte sintetico brilhante dialine secagem rapida branco gelo iquine,44.9,tintas,IQUINE,10
tinta vinil acrilica fosco aveludado pintalar branco neve iquine,38.9,tintas,IQUINE,10
tinta vinil acrilica fosco aveludado litros pintalar marfim iquine,42.9,tintas,IQUINE,10
tinta vinil acrilica fosco aveludado pintalar litros verde piscina iquine,42.9,tintas,IQUINE,10
diluente aguarras incolor iquine,29.9,complementos,IQUINE,2
tinta acrilica fosca pinta piso concreto coral,109.9,tintas,CORAL,10
tinta vinil acrilica fosco aveludado pintalar branco gelo iquine,38.9,tintas,IQUINE,10
tinta acrilica semibrilho super lavavel branco neve iquine,599.9,tintas,IQUINE,10
tinta vinil acrilica fosco aveludado litros pintalar palha iquine,42.9,tintas,IQUINE,10
tinta esmalte sintetico brilhante dialine secagem rapida azul mar iquine,44.9,tintas,IQUINE,10
tinta vinil acrilica fosco aveludado litros pintalar perola iquine,42.9,tintas,IQUINE,10
tinta vinil acrilica fosco aveludado litros pintalar verde primavera iquine,42.9,tintas,IQUINE,10
tinta acrilica semibrilho super lavavel branco gelo iquine,159.9,tintas,IQUINE,10
tinta esmalte sintetico brilhante dialine secagem rapida azul celeste iquine,44.9,tintas,IQUINE,10
tinta vinil acrilica fosco aveludado pintalar areia iquine,42.9,tintas,IQUINE,10
adesivo silicone bisnaga g polystic pulvitec,14.9,complementos,PULVITEC,2
