name,price,category,brand,target
suporte para vidro boca de jacare zamac cromado isero,19.9,ferragens,ISERO,6
rodizio fixo com placa e roda ferro mais esfera amarelo colson,136.9,ferragens,COLSON,6
punho em zamac tubo ferro cromado isero,54.9,ferragens,ISERO,6
fechadura externa para porta de correr roseta branca silvana,53.9,fechaduras,SILVANA,5
puxador cromado concha ferro de sobrepor redondo isero,12.9,ferragens,ISERO,6
suporte em aco para microondas branco brasforma,54.9,ferragens,BRASFORMA,6
fechadura eletrica c control abre para dentro ajustavel rfid branco hdl,699.0,ferragens,HDL,6
fecho em zamc latao oxidado concha de sobrepor retangular isero,84.9,ferragens,ISERO,6
puxador cromado concha ferro de sobrepor retangular isero,12.9,ferragens,ISERO,6
suporte para vidro boca de jacare zamac preto isero,19.9,ferragens,ISERO,6
puxador em latao oxidado concha ferro de sobrepor retangular isero,14.9,ferragens,ISERO,6
puxador em latao oxidado concha ferro de sobrepor redondo isero,14.9,ferragens,ISERO,6
abracadeira de aco galvanizado tipo d com cunha polegada silvana,1.9,ferragens,SILVANA,6
fechadura eletrica c control abre para dentro ajustavel rfid preta hdl,629.9,ferragens,HDL,6
fecho em zamc latao oxidado concha de sobrepor redondo isero,84.9,ferragens,ISERO,6
fecho em zamc latao cromado concha de sobrepor retangular isero,84.9,ferragens,ISERO,6
fonte de alimentacao v bivolt a para fechadura idk preto hdl,39.9,ferragens,HDL,6
tarjeta em zamac media cromada prata isero,49.9,ferragens,ISERO,6
fecho em zamc latao cromado concha de sobrepor redondo isero,84.9,ferragens,ISERO,6
fechadura wc para banheiro bola espelho preto fosco stam,57.9,fechaduras,STAM,5
rodizio giratorio com espiga e roda bp com freio mais rolamento de esfera preto colson,15.9,ferragens,COLSON,6
rodizio giratorio com espiga e roda bp com freio mais rolamento de esfera amarelo colson,34.9,ferragens,COLSON,6
rodizio giratorio com placa e roda bp rolamento de esfera amarela colson,25.9,ferragens,COLSON,6
fechadura para porta de enrolar preto fosco stam,75.9,fechaduras,STAM,5
fechadura eletrica v de sobrepor cilindro de abre para dentro preto fosco stam,148.9,fechaduras,STAM,5
rodizio giratorio com espiga e roda bp mais rolamento de esfera preto colson,15.9,ferragens,COLSON,6
fechadura sobrepor para portao espelho preto fosco stam,69.9,fechaduras,STAM,5
fechadura para porta de correr espelho buzios preto fosco stam,59.9,fechaduras,STAM,5
rodizio giratorio com espiga e roda bp mais rolamento de esfera amarelo colson,12.9,ferragens,COLSON,6
fechadura wc para banheiro alavanca espelho preto fosco stam,52.9,fechaduras,STAM,5
fechadura eletrica v de sobrepor cilindro de abre para fora preto fosco stam,199.9,fechaduras,STAM,5
rodizio fixo com placa e roda pu rolamento de esfera amarela colson,59.9,ferragens,COLSON,6
fechadura externa para porta de ferro alavanca espelho preto fosco stam,85.9,fechaduras,STAM,5
fechadura interna para porta de madeira alavanca espelho preto fosco stam,52.9,fechaduras,STAM,5
rodizio fixo institucional polegadas com espiga e roda mais furo passante cinza colson,29.9,ferragens,COLSON,6
rodizio fixo com espiga e roda em pvc mais furo passante cinza colson,12.9,ferragens,COLSON,6
rodizio fixo institucional polegadas com placa e roda mais furo passante cinza colson,21.9,ferragens,COLSON,6
fechadura sobrepor portao tetra preto fosco stam,102.9,fechaduras,STAM,5
fechadura interna para porta de madeira bola espelho preto fosco stam,57.9,fechaduras,STAM,5
rodizio giratorio com placa e roda bp rolamento de esfera preto colson,14.9,ferragens,COLSON,6
fechadura externa para porta de aluminio alavanca espelho buzios preto fosco stam,89.9,fechaduras,STAM,5
fechadura externa para porta de aluminio alavanca espelho inox preto fosco stam,119.9,fechaduras,STAM,5
fechadura para porta de aluminio alavanca espelho preto fosco stam,63.9,fechaduras,STAM,5
fechadura externa para porta de madeira alavanca espelho preto fosco stam,59.9,fechaduras,STAM,5
fechadura para porta de enrolar tetra preto fosco stam,53.9,fechaduras,STAM,5
fechadura para porta de correr espelho preto fosco stam,46.9,fechaduras,STAM,5
caixa de correio plastica xx nove,34.9,ferragens,NOVE54,6
fechadura externa para porta de madeira bola espelho preto fosco stam,69.9,fechaduras,STAM,5
fechadura para porta de correr espelho inox preto fosco stam,69.9,fechaduras,STAM,5
fechadura externa alavanca espelhada classic preto stam,249.9,fechaduras,STAM,5
fechadura externa alavanca roseta classic quadrado preto stam,209.9,fechaduras,STAM,5
fechadura porta de correr e bater roseta quadrada preto stam,119.9,fechaduras,STAM,5
puxador retangular silvana,409.9,ferragens,SILVANA,6
puxador retangular inox silvana,326.9,ferragens,SILVANA,6
fechadura externa seguranca alavanca roseta quadrado preto stam,115.9,fechaduras,STAM,5
ferrolho pega ladrao assa abloy,19.9,ferragens,SILVANA,6
fechadura wc alavanca roseta classic redondo preta stam,169.9,fechaduras,STAM,5
fechadura para porta de correr ou bater roseta redonda preto stam,99.9,fechaduras,STAM,5
puxador retangular assa abloy,289.9,ferragens,SILVANA,6
fechadura wc alavanca roseta classic quadrada preto stam,169.9,fechaduras,STAM,5
fechadura externa alavanca roseta classic quadrada preta stam,189.9,fechaduras,STAM,5
fechadura externa alavanca roseta classic redondo preto stam,183.9,fechaduras,STAM,5
fechadura wc roseta class quadrada preto stam,169.9,fechaduras,STAM,5
fechadura pivotante roseta redonda preta stam,109.9,fechaduras,STAM,5
puxador inox perfil retangular curvo polido silvana,259.9,ferragens,SILVANA,6
fechadura externa seguranca alavanca roseta redondo preto stam,109.9,fechaduras,STAM,5
fechadura interna alavanca roseta ravena quadrada cromado silvana,79.9,fechaduras,SILVANA,5
fechadura externa pivotante quadrada inox polido silvana,69.9,fechaduras,SILVANA,5
batedor de porta amortecedor zamac peca niquelado silvana,23.9,ferragens,SILVANA,6
fechadura wc alavanca espelhada classic preto stam,209.9,fechaduras,STAM,5
fechadura eletrica com cilindro ajustavel fxaj cinza intelbras,299.0,fechaduras,INTELBRAS,5
fechadura pivotante roseta quadrada preta stam,119.9,fechaduras,STAM,5
fechadura wc alavanca roseta ravena quadrado qc cromado silvana,79.9,fechaduras,SILVANA,5
fechadura interna caprii alavanca roseta redonda ri inox polido silvana,106.9,fechaduras,SILVANA,5
fechadura externa alavanca espelho inox stam,149.9,fechaduras,STAM,5
fechadura externa alavancaroseta redondo siena ri inox escovado silvana,119.9,fechaduras,SILVANA,5
fechadura externa alavancaroseta quadrado viena cromado silvana,89.9,fechaduras,SILVANA,5
fechadura wc alavanca espelho i inox escovado stam,89.9,fechaduras,STAM,5
fechadura externa alavanca roseta redonda capri ri inox polido silvana,129.9,fechaduras,SILVANA,5
fechadura wc alavanca roseta quadrada squadra qi inox escovado silvana,99.9,fechaduras,SILVANA,5
fechadura externa alavancaespelho uno s italyclass preto silvana,67.9,fechaduras,SILVANA,5
fechadura externa alavancaespelho tetra inox stam,178.9,fechaduras,STAM,5
fechadura interna alavancaespelho inox stam,105.9,fechaduras,STAM,5
fechadura wc alavanca espelho inox stam,105.9,fechaduras,STAM,5
fechadura interna alavancaespelho i inox escovado stam,84.9,fechaduras,STAM,5
fehadura pivotante roseta redondo inox stam,105.9,fechaduras,STAM,5
fechadura externa alavanca roseta quadrado ravena cromado silvana,99.9,fechaduras,SILVANA,5
fechadura interna siena inox escovado assa abloy,94.9,fechaduras,SILVANA,5
fechadura wc capri alavanca roseta redonda ri inox polido silvana,106.9,fechaduras,SILVANA,5
fechadura externa alavanca espelho i inox escovado stam,69.9,fechaduras,STAM,5
fechadura externa alavanca roseta quadrada squadra qi inox escovado silvana,119.9,fechaduras,SILVANA,5
fechadura interna alavanca roseta quadrada squadra qi inox escovado silvana,99.9,fechaduras,SILVANA,5
fechadura interna alavanca roseta viena quadrada cromada silvana,74.9,fechaduras,SILVANA,5
fechadura externa alavanca espelho i inox escovado stamv,128.9,fechaduras,STAM,5
fechadura wc alavanca roseta viena quadrado qc cromado silvana,74.9,fechaduras,SILVANA,5
fechadura porta correr bater quadrada rose stam,49.9,fechaduras,STAM,5
fechadura wc alavanca roseta redondo siena ri inox escovado silvana,94.9,fechaduras,SILVANA,5
fechadura pivotante roseta quadrada cromado inox stam,129.9,fechaduras,STAM,5
fechadura porta correr bater rose quadrado gold stam,97.9,fechaduras,STAM,5
fechadura portao sobrepor espelho inox branco stam,102.9,fechaduras,STAM,5
fechadura wc alavancaroseta i redondo inox polido stam,149.9,fechaduras,STAM,5
fechadura pivotante auxiliar cromado stam,32.9,fechaduras,STAM,5
fechadura pivotante roseta redonda inox stam,116.9,fechaduras,STAM,5
fechadura seguranca espelho roseta tetra branco stam,45.9,fechaduras,STAM,5
fechadura pivotante buzios roseta quadrado class gold stam,59.9,fechaduras,STAM,5
fechadura wc alavancaroseta quadrado class gold stam,87.9,fechaduras,STAM,5
fechadura pivotante roseta quadrada inox stam,85.9,fechaduras,STAM,5
fechadura wc alavanca roseta quadrado class inox escovado stam,164.9,fechaduras,STAM,5
fechadura pivotante roseta quadrado gold stam,69.9,fechaduras,STAM,5
fechadura interna alavanca roseta i redonda inox escovado stam,134.9,fechaduras,STAM,5
fechadura interna alavancaroseta i redonda inox polido stam,89.9,fechaduras,STAM,5
dobradica aco pivotante inox branco stam,159.9,ferragens,STAM,6
fechadura externa alavanca roseta i redonda inox polido stam,184.9,fechaduras,STAM,5
fechadura pivotante roseta quadrado rose stam,67.9,fechaduras,STAM,5
fechadura wc alavanca roseta i redondo inox escovado stam,149.9,fechaduras,STAM,5
fechadura externa alavancaespelho estreita inox branco stam,119.9,fechaduras,STAM,5
fechadura zamac interna alavancaespelho concept i cromado pado,159.9,fechaduras,PADO,5
fecho seguranca aco sem corrente fs cromo acetinado pado,46.9,ferragens,PADO,6
fechadura zamac externa bola roseta concept e cromado pado,109.9,fechaduras,PADO,5
fechadura interna alavancaroseta i quadrada inox polido stam,99.9,fechaduras,STAM,5
fechadura zamac wc bola roseta concept b cromado pado,99.9,fechaduras,PADO,5
fechadura externa alavanca roseta i quadrada inox polido stam,152.0,fechaduras,STAM,5
fechadura aco sobrepor portao concept preto pado,129.9,fechaduras,PADO,5
regulador de gas zamac p papaiz papaiz,59.9,ferragens,PAPAIZ,6
fechadura zamac wc alavanca roseta vivaldi b corten pado,219.9,fechaduras,PADO,5
puxador inox retangular escovado stam,275.9,ferragens,STAM,6
fechadura zamac wc alavanca espelho concept b cromado pado,159.9,fechaduras,PADO,5
bbpuxador inox reto escovado stam,414.9,ferragens,STAM,6
fechadura wc alavanca roseta i quadrada inox escovado stam,172.9,fechaduras,STAM,5
puxador inox tubular escovado stam,199.9,ferragens,STAM,6
puxador inox perfil retangular fosco preto stam,454.9,ferragens,STAM,6
fechadura interna alavancaroseta copa zamac i cromo acetinado pado,189.9,fechaduras,PADO,5
fechadura zamac externa alavanca espelho concept e cromado pado,169.9,fechaduras,PADO,5
fechadura zamac externa alavanca roseta vivaldi e corten pado,289.9,fechaduras,PADO,5
puxador inox tubular fosco preto stam,257.9,ferragens,STAM,6
fechadura wc alavancaroseta i quadrada inox polido stam,209.9,fechaduras,STAM,5
fechadura inox sobrepor portao concept inox escovado pado,139.9,fechaduras,PADO,5
puxador aluminio concept pca aluminio polido pado,447.9,ferragens,PADO,6
fechadura externa alavancaroseta copa zamac e cromo acetinado pado,239.9,fechaduras,PADO,5
suporte em aco a para tv inclinavel universal preto brasforma,49.9,ferragens,BRASFORMA,6
fechadura interno bola e espelho concept zamac e cromado pado,129.9,fechaduras,PADO,5
suporte para tv de a polegadas vesa preto pro elg,179.9,ferragens,ELG PEDESTAIS,6
fechadura externa alavancaespelho uno italy uc cromada silvana,69.9,fechaduras,SILVANA,5
dobradica latao pivoltante pv cromado pado,154.9,ferragens,PADO,6
suporte fixo para tv universal a polegadas elg,23.9,ferragens,ELG PEDESTAIS,6
dobradica aco concept cromado pado,34.9,ferragens,PADO,6
fechadura wc bolaespelho concept zamac b cromado pado,85.9,fechaduras,PADO,5
suporte em aco a para tv fixo universal preto brasforma,24.9,ferragens,BRASFORMA,6
suporte em aco a tv inclinavel preto brasforma,69.9,ferragens,BRASFORMA,6
olho magico aco amm sm cromado pado,34.9,ferragens,PADO,6
suporte para tv ate polegadas vesa preto elg,99.9,ferragens,ELG PEDESTAIS,6
suporte de aco para tv de a polegadas articulavel movimentos preto brasforma,69.9,ferragens,BRASFORMA,6
suporte para tv de a polegadas fixo universal elg,34.9,ferragens,ELG PEDESTAIS,6
trava porta aco universal cartela com magnetico cromado silvana,45.9,ferragens,SILVANA,6
suporte de aco para microondas com braco ajustavel branco brasforma,69.9,ferragens,BRASFORMA,6
fechadura wc alavanca roseta copa zamac b cromo acetinado pado,189.9,fechaduras,PADO,5
kit trilho em inox smart para porta stam,529.9,ferragens,STAM,6
suporte para tv de a polegadas elg,134.9,ferragens,ELG PEDESTAIS,6
numero abs apartamento pequeno cromado bemfixa,15.9,ferragens,BEMFIXA,6
suporte de aco para dvd e conversor digital preto brasforma,39.9,ferragens,BRASFORMA,6
numero abs residencial prata bemfixa,39.9,ferragens,BEMFIXA,6
prendedor de porta em zamac magnetico sm cromado pado,79.9,ferragens,PADO,6
numero de plastico abs com parafuso e bucha prata bemfixa,39.9,ferragens,BEMFIXA,6
suporte em aco para microondas ajustavel branco brasforma,69.9,ferragens,BRASFORMA,6
suporte de aco para microondas com braco ajustavel prata brasforma,65.9,ferragens,BRASFORMA,6
fechadura cromada externa serralheiro e pado,104.9,fechaduras,PADO,5
mola aco para rede niquelado silvana,49.9,ferragens,SILVANA,6
cadeado em latao pado,189.9,ferragens,PADO,6
kit cadeado lt com cadeados e chaves iguais pado,49.9,ferragens,PADO,6
fechadura externa buzios espelho correr branco stam,59.9,fechaduras,STAM,5
fechadura externa porta correr roseta oval niquelada silvana,49.9,fechaduras,SILVANA,5
fechadura externa estreita aluminio espelho branca stam,85.9,fechaduras,STAM,5
kit cadeado latao cadeados e chaves iguais pado,99.9,ferragens,PADO,6
fechadura wc zamac b cromada concept pado,129.9,fechaduras,PADO,5
fechadura externa alavanca roseta onix quadrada qo oxidado silvana ref,79.9,fechaduras,SILVANA,5
fechadura wc alavanca roseta retratil quadrada qo oxidada silvana,75.9,fechaduras,SILVANA,5
fechadura alavanca espelho perfis e concept zamak cromado pado,102.9,fechaduras,PADO,5
encurtador de aco para rede cartela com anjos oxidado silvana,49.9,ferragens,SILVANA,6
mola aco rede zincada silvana,49.9,ferragens,SILVANA,6
armador de rede inox chumbar polido silvana,69.9,ferragens,SILVANA,6
fechadura externa alavancaespelho italy uc cromada silvana,79.9,fechaduras,SILVANA,5
encurtador em aco rede cartela com anjo cromado silvana,102.9,ferragens,SILVANA,6
fechadura de banheiro alavanca roseta onix quadrada qc cromado silvana ref,69.9,fechaduras,SILVANA,5
fechadura externa porta correr roseta oval buzios niquelada silvana,59.9,fechaduras,SILVANA,5
fechadura externa estreita aluminio espelho gorje branca stam,63.9,fechaduras,STAM,5
fechadura externa cromada serralheiro e pado,93.9,fechaduras,PADO,5
fechadura wc alavanca roseta onix quadrada qo oxidado silvana,73.9,fechaduras,SILVANA,5
fechadura externa buzios espelho branco stam,76.9,fechaduras,STAM,5
fechadura interna alavanca roseta onix quadrada qo oxidado silvana,73.9,fechaduras,SILVANA,5
fechadura interna alavanca roseta italy quadrada qc cromada silvana,59.9,fechaduras,SILVANA,5
fechadura externa alavanca roseta concept e zamak cromado pado,139.9,fechaduras,PADO,5
echadura externa alavanca roseta retratil quadrada qc cromada silvana,87.9,fechaduras,SILVANA,5
fechadura externa com alavanca espelho ce concept zamac cromado pado,119.9,fechaduras,PADO,5
fechadura interna alavanca retra oxidada silvana,75.9,fechaduras,SILVANA,5
fechadura interna alavanca roseta concept i ixp pado,139.9,fechaduras,PADO,5
fechadura externa alavanca roseta onix quadrada qc cromado silvana,85.9,fechaduras,SILVANA,5
fechadura wc alavanca espelho concept b zamac cromado pado,99.9,fechaduras,PADO,5
fechadura externa alavanca e roseta concept e zamac cromado pado,108.9,fechaduras,PADO,5
fechadura zamac b cromada concept pado,99.9,fechaduras,PADO,5
fechadura interna cromada residence i pado,99.9,fechaduras,PADO,5
fechadura interna com alavanca espelho concept ci zamak cromada pado,104.9,fechaduras,PADO,5
fechadura externa alavanca roseta retra quadrado qo oxidado silvana,95.9,fechaduras,SILVANA,5
fechadura interna alavanca italy oxidada silvana,59.9,fechaduras,SILVANA,5
fechadura wc alavanca espelho concept cb zamak cromada pado,109.9,fechaduras,PADO,5
fechadura wc alavanca roseta concept b ixp pado,139.9,fechaduras,PADO,5
fechadura interna alavanca onix silvana,69.9,fechaduras,SILVANA,5
fechadura interna alavanca roseta concept i zamak cromado pado,129.9,fechaduras,PADO,5
fechadura externa alavanca roseta concept e ixp pado,169.9,fechaduras,PADO,5
fechadura interna alavanca roseta retra quadrada qc cromada silvana,69.9,fechaduras,SILVANA,5
fechadura interna alavanca roseta italy quadrada qc oxidado silvana,59.9,fechaduras,SILVANA,5
fechadura externa alavanca roseta italy quadrada qc cromado silvana,75.9,fechaduras,SILVANA,5
fechadura interna alavanca espelho onix zero zo oxidada silvana,69.9,fechaduras,SILVANA,5
fechadura externa alavanca roseta italy quadrada qo oxidado silvana ref,75.9,fechaduras,SILVANA,5
fechadura externa alavanca oxidada onix silvana,89.9,fechaduras,SILVANA,5
fechadura roseta inox escovado silvana,79.9,fechaduras,SILVANA,5
puxador inox tubular polido stam,314.9,ferragens,STAM,6
dobradica aco pivotante zincado stam,89.9,ferragens,STAM,6
puxador inox quadrado polido stam,299.9,ferragens,STAM,6
puxador inox retangular polido stam,409.9,ferragens,STAM,6
fechadura externa alavanca cromada italy class silvana,67.9,fechaduras,SILVANA,5
fechadura wc alavanca e roseta retra quadrada qc cromado silvana,69.9,fechaduras,SILVANA,5
fechadura interna alavanca espelho italy pc cromada silvana,53.9,fechaduras,SILVANA,5
fechadura externa alavanca roseta italy quadrada qo oxidado silvana,75.9,fechaduras,SILVANA,5
fechadura roseta inox escovado alavanca silvana,78.9,fechaduras,SILVANA,5
prendedor de porta em inox magnetico polido stam,79.9,ferragens,STAM,6
fechadura para banheiro alavanca onix oxidada silvana,69.9,fechaduras,SILVANA,5
fechadura externa macaneta caprii roseta redonda ri inox escovado silvana externa macaneta capri roseta redonda ri inox escovado silvana,114.9,fechaduras,SILVANA,5
fechadura wc alavanca e roseta italy quadrada qc cromada silvana,59.9,fechaduras,SILVANA,5
fechadura wc alavanca espelho italy pc cromado silvana,53.9,fechaduras,SILVANA,5
fechadura wc alavanca roseta italy quadrada qo oxidado silvana,59.9,fechaduras,SILVANA,5
puxador em inox retangular polido stam,289.9,ferragens,STAM,6
esticador aco forjado cabo de aco nove,2.99,ferragens,NOVE54,6
fechadura zamac externa espelho concept e cromado pado,109.9,fechaduras,PADO,5
fechadura externa espelho e concept cromado pado,102.9,fechaduras,PADO,5
fechadura cromada wc residence b pado,84.9,fechaduras,PADO,5
corrente aco rede silvana,19.9,ferragens,SILVANA,6
valvula de seguranca para fogao glpgn npt interno jackwal,59.9,ferragens,JACKWAL,6
caixa correio grande de aluminio jornal xxcm metasal,69.9,ferragens,METASAL,6
puxador inox tubular polido silvana,329.9,ferragens,SILVANA,6
fechadura buzius espelhado inox stam,116.9,fechaduras,STAM,5
corrente de aco para cadeado zincada silvana,19.9,ferragens,SILVANA,6
puxador inox tubular escovado silvana,329.9,ferragens,SILVANA,6
kit de instalacao cooktops metro glpgn com valvula de bloqueio e aperto rapido jackwal,209.9,ferragens,JACKWAL,6
fechadura externa aluminio espelho buzios macaneta ix stam,104.9,fechaduras,STAM,5
fechadura sobrepor portao preta silvana,64.9,fechaduras,SILVANA,5
puxador inox reto polido silvana,419.9,ferragens,SILVANA,6
valvula de seguranca para fogao glpgn npt externo jackwal,56.9,ferragens,JACKWAL,6
kit de instalacao cooktops metro glp para botijao com aperto rapido jackwal,169.9,ferragens,JACKWAL,6
fechadura interna com roseta quadrada retro cromada pado,289.9,fechaduras,PADO,5
trava de seguranca zamac sm milano cromada pado,189.9,ferragens,PADO,6
veda porta de aluminio natural quality,8.9,ferragens,QUALITY,6
fechadura externa estreita aluminio espelho inox stam,69.9,fechaduras,STAM,5
puxador inox reto escovado silvana,237.9,ferragens,SILVANA,6
trava de seguranca zamac sm milano cromado pado,179.9,ferragens,PADO,6
trava porta de plastico pezinho para piso viva bemfixa,26.9,ferragens,BEMFIXA,6
cadeado em latao tetra pado,109.9,ferragens,PADO,6
fechadura de aco zamac externa alavanca roseta e retro cromada pado,329.9,fechaduras,PADO,5
fechadura externa alavanca roseta quadrada classic cromada stam,199.9,fechaduras,STAM,5
fechadura interna alavanca roseta i nina zamac cromado pado,279.9,fechaduras,PADO,5
fechadura externa com roseta quadrada nina cromada pado,339.9,fechaduras,PADO,5
fechadura wc alavanca roseta b nina zamac cromado pado,279.9,fechaduras,PADO,5
fechadura para porta de correr roseta externa escovada stam,69.9,fechaduras,STAM,5
mola aerea de metal para porta forca linha silvana,179.9,ferragens,SILVANA,6
fechadura para banheiro com roseta quadrada retro cromada pado,289.9,fechaduras,PADO,5
fechadura serralheiro alavanca espelhada inox stam,119.9,fechaduras,STAM,5
dobradica aco cartela com cromada silvana,49.9,ferragens,SILVANA,6
fechadura externa aluminio espelho inox stam,92.9,fechaduras,STAM,5
fechadura serralheiro cromado pado,115.9,fechaduras,PADO,5
fechadura externa com espelho victoria cromada pado,319.9,fechaduras,PADO,5
fechadura wc alavanca espelho b victoria zamac cromado pado,299.9,fechaduras,PADO,5
fechadura interna alavanca e roseta i contemporanea zamac cromado pado,199.9,fechaduras,PADO,5
fechadura wc alavanca roseta b magnum zamac cromado pado,125.9,fechaduras,PADO,5
fechadura de aco zamac interna alavanca roseta i copa cromada pado,169.9,fechaduras,PADO,5
fechadura para banheiro com roseta redonda contemporanea cromada pado,199.9,fechaduras,PADO,5
fechadura inox wc alavancaroseta b retro inox escovado pado,299.9,fechaduras,PADO,5
fechadura wc alavanca espelho b madrid zamac cromado pado,149.9,fechaduras,PADO,5
fechadura wc alavanca roseta b copa zamac cromado pado,169.9,fechaduras,PADO,5
fechadura externa em inox escovado serralheiro retro pado,339.9,fechaduras,PADO,5
fechadura interna alavanca roseta i victoria zamac cromado pado,249.9,fechaduras,PADO,5
regulador gas zamac com mangueira de medio alianca,76.9,ferragens,ALIANA,6
fechadura ionx interna alavanca e roseta retro i inox escovado pado,299.9,fechaduras,PADO,5
fechadura externa alavanca roseta e victoria zamac cromado pado,289.9,fechaduras,PADO,5
fechadura de aco zamac externa alavanca roseta e madrid cromada pado,189.9,fechaduras,PADO,5
fechadura externa com espelho madrid cromado pado,207.9,fechaduras,PADO,5
fechadura para banheiro com roseta redonda victoria cromada pado,249.9,fechaduras,PADO,5
fechadura interna alavanca espelho i victoria zamac cromado pado,299.9,fechaduras,PADO,5
fechadura para banheiro com roseta redonda marina cromado pado,219.9,fechaduras,PADO,5
fechadura externa alavanca roseta e contemporanea zamac cromado pado,229.9,fechaduras,PADO,5
fechadura wc alavanca roseta b karli zamac cromado pado,159.9,fechaduras,PADO,5
fechadura inox wc alavancaroseta retro b inox polido pado,289.9,fechaduras,PADO,5
fechadura para banheiro com roseta redonda madrid cromado pado,159.9,fechaduras,PADO,5
fechadura wc alavanca roseta b luma ixe pado,229.9,fechaduras,PADO,5
fechadura wc alavanca e roseta b luma ixp pado,249.9,fechaduras,PADO,5
fechadura wc alavanca roseta b erich zamac cromado pado,149.9,fechaduras,PADO,5
fechadura externa com roseta redonda luma inox escovado pado,249.9,fechaduras,PADO,5
fechadura externo com roseta redonda victoria inox polido pado,279.9,fechaduras,PADO,5
fechadura wc alavanca roseta b victoria ixp pado,215.9,fechaduras,PADO,5
fechadura interno com roseta redonda luma inox polido pado,249.9,fechaduras,PADO,5
fechadura externa alavanca roseta e luma ixp pado,259.9,fechaduras,PADO,5
fechadura externo alavanca e roseta e magnum zamac cromado pado,159.9,fechaduras,PADO,5
fechadura wc roseta b sara zamac cromado pado,299.9,fechaduras,PADO,5
fechadura externa alavanca roseta e retro ixp pado,339.9,fechaduras,PADO,5
fechadura interna roseta i sara zamac cromado pado,299.9,fechaduras,PADO,5
fechadura interna alavanca roseta i luma ixe pado,229.9,fechaduras,PADO,5
fechadura inox interna alavancaroseta retro i inox polido pado,329.9,fechaduras,PADO,5
fechadura externa alavanca espelho e evidence zamac cromado pado,148.9,fechaduras,PADO,5
fechadura wc alavanca espelho b evidence zamac cromado pado,104.9,fechaduras,PADO,5
fechadura externa zamac alavanca roseta e copa cromada pado,209.9,fechaduras,PADO,5
fechadura externa com roseta quadrada karli cromado pado,279.9,fechaduras,PADO,5
fechadura inox externa roseta e marina ixp pado,309.9,fechaduras,PADO,5
fechadura wc alavanca roseta b marina ixp pado,219.9,fechaduras,PADO,5
fechadura zamak roseta externa sara e cromado pado,389.9,fechaduras,PADO,5
fechadura para banheiro com roseta redonda evidence cromado pado,112.9,fechaduras,PADO,5
cadeado latao haste longa stam,31.9,ferragens,STAM,6
trava porta inox smt escovado pado,209.9,ferragens,PADO,6
fechadura interna alavanca espelho inox stam,67.9,fechaduras,STAM,5
cadeado de latao com haste media cartela stam,24.9,ferragens,STAM,6
fechadura externa alavanca e roseta e vic zamac cromado pado,199.9,fechaduras,PADO,5
fechadura externa alavanca roseta e classic zamac cromado pado,179.9,fechaduras,PADO,5
fechadura wc alavanca roseta b mari zamac cromado pado,145.9,fechaduras,PADO,5
fechadura interna alavanca e roseta i classic zamac cromado pado,169.9,fechaduras,PADO,5
