name,price,category,brand,target
torneira de mesa para lavatorio bica baixa metal basic plus cromado celite,579.9,torneiras,CELITE,11
torneira de parede para uso geral metal up cromado celite,209.9,torneiras,CELITE,11
torneira de mesa para lavatorio bica baixa metal up cromado celite,229.9,torneiras,CELITE,11
cantoneira plastica com saboneteira branco astra*br,39.9,acess_sanitarios,ASTRA,1
torneira de mesa para cozinha bica movel com arejador articulado metal up cromado celite,298.9,torneiras,CELITE,11
torneira para lavatorio em metal de mesa bica alta basic plus cromado celite,685.9,torneiras,CELITE,11
torneira para cozinha em metal de parede bica movel one cromado celite,165.9,torneiras,CELITE,11
torneira para cozinha em metal de mesa bica movel one cromado celite,129.9,torneiras,CELITE,11
torneira para uso geral em metal de parede one cromado celite,168.9,torneiras,CELITE,11
torneira de parede para jardim com bico metal up cromado celite,165.9,torneiras,CELITE,11
torneira para maquina de lavar metal de parede up cromado celite,339.9,torneiras,CELITE,11
torneira para lavatorio em metal de parede elite cromado celite,499.9,torneiras,CELITE,11
torneira para maquina de lavar em metal one cromado celite,268.9,torneiras,CELITE,11
torneira para lavatorio em metal de mesa bica baixa one cromado celite,199.9,torneiras,CELITE,11
torneira para lavatorio em metal de mesa bica alta one cromado celite,139.9,torneiras,CELITE,11
torneira para cozinha em metal de parede com arejador articulado single one cromado roca,309.9,torneiras,ROCA,11
torneira de parede para cozinha metal basic cromado celite,369.9,torneiras,CELITE,11
torneira para lavatorio em metal de mesa bica alta up cromado celite,239.9,torneiras,CELITE,11
barra de apoio reta em pvc branca astra*br,115.9,acess_sanitarios,ASTRA,1
torneira para lavatorio em metal de mesa next cromado docol,739.9,torneiras,DOCOL,11
kit instalacao bacia caixa acoplada ckitpcd deca,199.9,acess_sanitarios,DECA,1
torneira de mesa para lavatorio metal pressmatic loggica cromado docol,829.9,torneiras,DOCOL,11
torneira para lavatorio em metal de parede next cromado docol,629.9,torneiras,DOCOL,11
desviador para chuveiro em metal especial cromado docol,399.9,acess_sanitarios,DOCOL,1
kit de instalacao para bacia convencional ckitp deca,249.9,acess_sanitarios,DECA,1
barra de apoio pvc circular bp branco *br astra,77.9,acess_sanitarios,ASTRA,1
kit de instalacao bacia convencional ckitp deca,279.9,acess_sanitarios,DECA,1
porta toalha duplo com barra em metal top cromado docol,668.9,acess_sanitarios,DOCOL,1
torneira cromada basic de mesa bica baixa cromada celite,159.9,torneiras,CELITE,11
saboneteira de plastico para mesa astrasb*arg,16.9,acess_sanitarios,ASTRA,1
torneira de parede basic cromado celite,259.9,torneiras,CELITE,11
parafuso latonado b cartela com carv pl sp cromado deca,49.9,acess_sanitarios,DECA,1
boia para caixa acoplada kfu astra,35.9,acess_sanitarios,ASTRA,1
torneira para cozinha metal de parede longa econoline c cromada sigma,79.9,torneiras,SIGMA,11
torneira para tanque em metal eco c cromada sigma,74.9,torneiras,SIGMA,11
torneira cromada basic de mesa bica alta cromada celite,199.9,torneiras,CELITE,11
torneira para cozinha em metal de parede econoline c cromada sigma,76.9,torneiras,SIGMA,11
elemento filtrante refil para torneira com filtro abs sigma,34.9,torneiras,SIGMA,11
torneira de metal bica baixa para lavatorio ecoline sigma,67.9,torneiras,SIGMA,11
reparo para torneira mvs ceramica sigma,51.9,torneiras,SIGMA,11
reparo para registro mvs sigma,24.9,acess_sanitarios,SIGMA,1
torneira cromada de parede para cozinha com filtro tivoli sigma,199.9,torneiras,SIGMA,11
torneira para maquina de lavar metal eco c sigma,96.9,torneiras,SIGMA,11
torneira para tanque em metal tivoli cromado sigma,109.9,torneiras,SIGMA,11
porta toalha em metal com barra idea cromado docol,119.9,acess_sanitarios,DOCOL,1
tubo de ligacao para bacia sanitaria em metal polegadas cromado docol,109.9,acess_sanitarios,DOCOL,1
tubo ligacao inox flex trancado docol,54.9,acess_sanitarios,DOCOL,1
papeleira em metal idea cromado docol,42.9,acess_sanitarios,DOCOL,1
kit de acessorios para banheiro com pecas em metal ideal cromado docol,139.9,acess_sanitarios,DOCOL,1
tubo ligacao flexivel inox trancado docol,84.9,acess_sanitarios,DOCOL,1
saboneteira de parede em metal idea cromado docol,42.9,acess_sanitarios,DOCOL,1
saboneteira inox de parede rieti cromado sigma,189.9,acess_sanitarios,SIGMA,1
tubo de ligacao para bacia sanitaria metal cromado docol,229.9,acess_sanitarios,DOCOL,1
porta toalha de rosto em metal idea cromado docol,88.9,acess_sanitarios,DOCOL,1
cabide de metal gancho idea cromado docol,37.9,acess_sanitarios,DOCOL,1
torneira para tanque metal turim cromada sigma,86.9,torneiras,SIGMA,11
torneira metalica de mesa para lavatorio tivoli sigma,132.9,torneiras,SIGMA,11
torneira cromada de parede para lavatorio tivoli sigma,149.9,torneiras,SIGMA,11
anel vedacao com guia bacia sanitaria pulvitec,9.9,acess_sanitarios,PULVITEC,1
torneira cromada de mesa para lavatorio tivoli sigma,162.9,torneiras,SIGMA,11
barra de apoio de aluminio reta sicmol,128.9,acess_sanitarios,SICMOL,1
torneira de mesa cromada bica baixa singles one roca,339.9,torneiras,ROCA,11
torneira de mesa para cozinha turim sigma,109.9,torneiras,SIGMA,11
cano plastico para chuveiro branco fame,29.9,acess_sanitarios,FAME,1
torneira metalica de parede para cozinha turim sigma,124.9,torneiras,SIGMA,11
torneira metalica de mesa para cozinha turim sigma,138.9,torneiras,SIGMA,11
torneira para cozinha em metal de parede longa com arejador terni cromada sigma,158.9,torneiras,SIGMA,11
torneira para filtro alavanca manual bitola laranja e preto herc,7.9,torneiras,HERC,11
esguicho pistola com engate para mangueira herc,23.9,torneiras,HERC,11
torneira para filtro alavanca manual de polegada branca e azul herc,9.9,torneiras,HERC,11
torneira para lavatorio em metal de mesa link conforto cromado clnk deca,689.9,torneiras,DECA,11
kit city para banheiro com pecas celite,839.9,acess_sanitarios,CELITE,1
mecanismo de entrada para caixa acoplada universal altabaixa pressao censi,61.9,acess_sanitarios,CENSI,1
kit acessorios banheiro policarbonato pecas dakar cristalcromado duda,48.9,acess_sanitarios,DUDA,1
cabide metalico com gancho clean cromado ccln deca,349.9,acess_sanitarios,DECA,1
porta toalha em metal com barra clean cromado ccln deca,899.9,acess_sanitarios,DECA,1
prateleira cantoneira plastica com saboneteira branco astra*br,79.9,acess_sanitarios,ASTRA,1
kit de acessorios para banheiro pecas dakar branco duda,34.9,acess_sanitarios,DUDA,1
reparador plastico ligacao de mangueira laranja herc,5.9,torneiras,HERC,11
saboneteira plastica com ventosa cristal astrasab*crist,32.9,acess_sanitarios,ASTRA,1
porta toalha em metal bar disco cromada cdsc deca,729.9,acess_sanitarios,DECA,1
bico de torneira de jardim plastico polegada e polegada laranja herc,4.3,torneiras,HERC,11
derivador de plastico selet pass saidas laranja herc,9.99,torneiras,HERC,11
kit de acessorios para banheiro pecas dakar fume duda,48.9,acess_sanitarios,DUDA,1
cabide em metal gancho disco cromado cdsc deca,349.9,acess_sanitarios,DECA,1
derivador de plastico pass livre saidas laranja herc,7.9,torneiras,HERC,11
porta toalha em metal barra disco cromado cdsc deca,855.9,acess_sanitarios,DECA,1
papeleira metal clean cromado ccln deca,709.9,acess_sanitarios,DECA,1
engate rapido de plastico para mangueira passe livre laranja herc,9.9,torneiras,HERC,11
engate rapido de plastico para mangueira stop laranja herc,9.9,torneiras,HERC,11
saboneteira de parede cromada disco decacdsc,799.9,acess_sanitarios,DECA,1
papeleira em metal top cromado docol,259.9,acess_sanitarios,DOCOL,1
tubo caixa de desgarga pvc mmxcm granplast,13.9,acess_sanitarios,GRANPLAST,1
prateleira acrilica top em metal cromado docol,719.9,acess_sanitarios,DOCOL,1
bolsa de ligacao em polipropileno excentrica preta astraas,29.9,acess_sanitarios,ASTRA,1
cabide metalico com gancho top cromado docol,159.9,acess_sanitarios,DOCOL,1
porta toalha com barra em metal top cromado docol,329.9,acess_sanitarios,DOCOL,1
torneira para lavatorio em metal de parede polo cromado c deca,936.9,torneiras,DECA,11
saboneteira acrilica de parede top em metal cromado docol,289.9,acess_sanitarios,DOCOL,1
caixa de descarga plastica branco granplast,29.9,acess_sanitarios,GRANPLAST,1
entrada para caixa acoplada de plastico universal alta e baixa pressao blukit,52.9,acess_sanitarios,BLUKIT,1
porta toalha argola em metal top cromado docol,299.9,acess_sanitarios,DOCOL,1
torneira para cozinha em aco de mesa com bica movel v gourmet atlantic cromada dimar,95.9,torneiras,DIMAR,11
torneira para cozinha em aco de parede com bica movel v pacific cromado dimar,99.9,torneiras,DIMAR,11
torneira para cozinha em aco de mesa com bica alta v atlantic cromado dimar,86.9,torneiras,DIMAR,11
torneira para cozinha em aco de parede com bica movel v atlantic cromado dimar,99.9,torneiras,DIMAR,11
torneira para lavatorio de mesa com bica baixa antartic cromada dimar,249.9,torneiras,DIMAR,11
torneira para cozinha em aco de parede com bica movel v gourmet atlantic cromada dimar,109.9,torneiras,DIMAR,11
torneira para tanque em aco de parede v pacific cromado dimar,49.9,torneiras,DIMAR,11
torneira para cozinha em aco de parede com bica movel v gourmet atlantic preta dimar,119.9,torneiras,DIMAR,11
torneira para cozinha em aco de mesa com bica movel v gourmet atlantic preta dimar,99.9,torneiras,DIMAR,11
torneira para tanque em aco de parede v atlantic cromado dimar,59.9,torneiras,DIMAR,11
torneira para cozinha em aco de mesa com bica movel v gourmet pacific cromada dimar,89.9,torneiras,DIMAR,11
torneira para lavatorio de mesa com bica alta antartic cromada dimar,299.9,torneiras,DIMAR,11
torneira para lavatorio em aco de mesa com bica baixa v atlantic cromado dimar,69.9,torneiras,DIMAR,11
torneira para lavatorio de mesa com bica baixa antartic preto fosco dimar,259.9,torneiras,DIMAR,11
torneira para cozinha em aco de parede com bica movel v gourmet pacific preta dimar,129.9,torneiras,DIMAR,11
torneira para cozinha em aco de mesa com bica movel v gourmet pacific preta dimar,99.9,torneiras,DIMAR,11
torneira para tanque em aco de parede v com bico pacific cromado dimar,59.9,torneiras,DIMAR,11
torneira para lavatorio de mesa com bica alta antartic preto dimar,349.9,torneiras,DIMAR,11
torneira para cozinha em aco de mesa com bica alta v pacific cromado dimar,79.9,torneiras,DIMAR,11
torneira para cozinha em aco de parede com bica movel v gourmet pacific cromado dimar,119.9,torneiras,DIMAR,11
torneira para tanque em aco de parede v com bico atlantic cromado dimar,65.9,torneiras,DIMAR,11
purificador de agua em abs com torneira acqua bella branco lorenzetti,119.9,torneiras,LORENZETTI,11
torneira para lavatorio metal de parede hospitalar cromada sigma,189.9,torneiras,SIGMA,11
elemento de filtro aquatotal aqte,57.9,torneiras,3M,11
porta toalha em metal barra ottone cromado sigma,113.9,acess_sanitarios,SIGMA,1
filtro d agua para torneira polipropileno versatille lorenzetti,174.9,torneiras,LORENZETTI,11
torneira de mesa bica baixa sigmatic sigma,229.9,torneiras,SIGMA,11
torneira em plastico de parede para tanque herc,4.49,torneiras,HERC,11
papeleira de metal ottone cromada sigma,79.9,acess_sanitarios,SIGMA,1
subconjunto arejador cromado polegada deca,21.9,torneiras,DECA,11
vedacao de borracha aquapluv style tigre,3.29,acess_sanitarios,TIGRE,1
saboneteira em metal ottone cromado sigma,89.9,acess_sanitarios,SIGMA,1
filtro d agua polipropileno polegadas loren acqua branco lorenzetti,299.9,torneiras,LORENZETTI,11
braco para chuveiro em abs tela filtro spa metalico hydraco,20.9,acess_sanitarios,HYDRA,1
porta shampoo metal luxo cromado metais leao,182.9,acess_sanitarios,METAIS LEAO,1
torneira hospitalar de mesa bica baixa sigma,185.9,torneiras,SIGMA,11
elemento filtro de entrada agua deca,139.9,torneiras,DECA,11
filtro de agua para ponto de uso loren acqua branco lorenzetti,219.9,torneiras,LORENZETTI,11
extensor em abs com arejador para torneira de cozinha branco cromado blukit,16.9,torneiras,BLUKIT,11
elemento de filtro micra aquapurity,125.9,torneiras,3M,11
reparo para registro de pressao docol mvs blukit,52.9,acess_sanitarios,BLUKIT,1
refil de filtro micra aqualar ap,84.9,torneiras,3M,11
extensao metal cromado para chuveiro e torneira blukit,30.9,acess_sanitarios,BLUKIT,1
torneira de mesa para lavatorio metal pressmatic benefit cromado docol,899.9,torneiras,DOCOL,11
valvula economica para pia america polegadas aco inox e polipropileno tramontina,39.9,acess_sanitarios,TRAMONTINA,1
kit acessorios banheiro acoaluminio pecas junior leao metais,74.9,acess_sanitarios,METAIS LEAO,1
conjunto de fixacao para mictorio incepa celite,95.9,acess_sanitarios,CELITE,1
torneira de mesa para lavatorio bica alta movel pratica branca herc,35.9,torneiras,HERC,11
torneira de mesa para lavatorio bica alta movel pratica cinza claro herc,24.9,torneiras,HERC,11
torneira branca de parede bica longa para cozinha foz viqua,39.9,torneiras,VIQUA,11
torneira para cozinha plastica mesa bica movel pratica cinza claro herc,29.9,torneiras,HERC,11
kit acessorios banheiro policarbonato pecas monaco cristalcromado duda,59.9,acess_sanitarios,DUDA,1
torneira de mesa para lavatorio maruja bica alta viqua,55.9,torneiras,VIQUA,11
parafuso para fixacao de tanque latao cromado deca,82.9,acess_sanitarios,DECA,1
torneira de parede para cozinha bica longa abs maruja branco viqua,39.9,torneiras,VIQUA,11
torneira para cozinha plastica de parede pratica bica movel cinza claro herc,27.9,torneiras,HERC,11
torneira para lavatorio plastico de mesa plus bica movel branco herc,29.9,torneiras,HERC,11
kit acessorios banheiro policarbonato pecas monaco branco duda,44.9,acess_sanitarios,DUDA,1
torneira para cozinha plastico de mesa pratica bica movel branco herc,24.9,torneiras,HERC,11
kit acessorios banheiro policarbonato pecas monaco fumecromado duda,62.9,acess_sanitarios,DUDA,1
torneira para lavatorio plastico bica alta cinza claro herc,24.9,torneiras,HERC,11
torneira cozinha metal parede bica alta max c cromado c deca,349.9,torneiras,DECA,11
prolongador de latao para registro deca cromado blukit,57.9,acess_sanitarios,BLUKIT,1
torneira para cozinha plastica de parede pratica bica movel branca herc,29.9,torneiras,HERC,11
valvula para lavatorio metal polegada tampa em metal cromado docol,71.9,acess_sanitarios,DOCOL,1
torneira de mesa para lavatorio metal riva cromado docol,199.9,torneiras,DOCOL,11
torneira para cozinha em metal de mesa max cromado c deca,329.9,torneiras,DECA,11
torneira de parede cromada bica movel para cozinha maruja viqua,55.9,torneiras,VIQUA,11
kit mecanismo para caixa acoplada com acionamento superior censi,149.9,acess_sanitarios,CENSI,1
kit mecanismo para caixa acoplada completa acionador lateral censi,154.9,acess_sanitarios,CENSI,1
torneira cromada maruja de mesa para cozinha viqua,59.9,torneiras,VIQUA,11
torneira de mesa cromada bica baixa para banheiro maruja viqua,51.9,torneiras,VIQUA,11
kit instalacao pratico lorenzetti,24.9,acess_sanitarios,LORENZETTI,1
torneira para tanque abs cromada viqua,52.9,torneiras,VIQUA,11
torneira maruja branca para pia viqua,28.9,torneiras,VIQUA,11
torneira para cozinha plastica de mesa plus com bica movel cinza claro herc,29.9,torneiras,HERC,11
anel de vedacao para bacia sanitaria com guia decanel deca,39.9,acess_sanitarios,DECA,1
reparo para torneira completo tigre,39.9,torneiras,TIGRE,11
botao lateral plastico para caixa acoplada acionador cromado censi,34.9,acess_sanitarios,CENSI,1
torneira para cozinha plastica de parede plus com bica movel branco herc,25.9,torneiras,HERC,11
obturador para caixa acoplada censi,17.9,acess_sanitarios,CENSI,1
estribo de aco venda por unidade gerdau,0.99,complementos,GERDAU,2
porcelanato carrara branco cetim polido tipo a incesa,119.9,porcelanatos,INCESA,9
tinta esmalte brilho litros coralit areia coral,189.9,tintas,CORAL,10
tinta acrilica coralar acrilico fosco areia coral,69.9,tintas,CORAL,10
porta sabonete liquido plastico flora areia coza,25.9,cozinha,COZA,4
cal hidratado saco com megao,24.9,tintas,MEGAO,10
cal hidratado supercal branco hidracorref,13.9,tintas,HIDRACOR,10
tinta acrilica fosca renova gesso e drywall branco neve coral,389.9,tintas,CORAL,10
massa epoxi durepoxi cinza g loctite,29.9,complementos,HENKEL,2
massa epoxi g polyepox pulvitec,6.9,complementos,PULVITEC,2
massa epoxi g durepoxi cinza loctite henkel,7.9,complementos,HENKEL,2
adesivo epoxi mix g transparente scotch,35.9,complementos,3M,2
espumadeira em silicone com cabo de madeira cinza hauskraft,25.9,cozinha,HAUSKRAFT,4
cabo madeira martelo comfort,7.9,acess_ferramentas,MOMFORT,0
nivel de madeira momfort,29.9,acess_ferramentas,MOMFORT,0
ferrolho aco fio redondo cartela com ferro zincado oxidado envernizado silvana,15.9,ferragens,SILVANA,6
ferrolho aco fio redondo cartela com peca ferro zincado oxidado envernizado silvana,18.9,ferragens,SILVANA,6
sapata anti brilho para ferro de passar plastleo,29.9,cozinha,PLAST LEO,4
resina multiuso litros ceramica telha hydronorth,304.9,complementos,HYDRONORTH,2
caneca de vidro glacial lyor,9.9,cozinha,LYOR,4
manteigueira em vidro gomus hauskraft,33.9,cozinha,HAUSKRAFT,4
pote de vidro quadrado sanremo,39.9,cozinha,SANREMO,4
caneca de vidro transparente prasvale,4.9,cozinha,PLASVALE,4
jarra de vidro diamond lyor,53.9,cozinha,LYOR,4
saleiro de vidro cores sortidas lyor,5.9,cozinha,LYOR,4
jarra de vidro coracao lyor,53.9,cozinha,LYOR,4
caneca de vidro litros diamante plasvale,9.9,cozinha,PLASVALE,4
saleiro e pimenteiro de vidro elegance hauskraft,14.9,cozinha,HAUSKRAFT,4
caneca de vidro para cerveja frankfurt lyor,17.9,cozinha,LYOR,4
copo de vidro para shot sortido lyor,4.9,cozinha,LYOR,4
garrafa de vidro para azeite vermelho lyor,11.9,cozinha,LYOR,4
dobradica aco polegas cartela com unidades ferro zincado oxidado envernizado silvana,19.9,ferragens,SILVANA,6
dobradica aco polegadas cartela com unidades ferro zincado oxidado envernizado silvana,19.9,ferragens,SILVANA,6
dobradica aco cartela cromada silvana,49.9,ferragens,SILVANA,6
dobradica em aco cartela com inox escovado silvana,139.9,ferragens,SILVANA,6
dobradica aco cartela com ferro zincado oxidado envernizado silvana,32.9,ferragens,SILVANA,6
dobradica aco cartela com unidades ferro zincado oxidado envernizado silvana,13.9,ferragens,SILVANA,6
dobradica aco cartela com unidades zincada silvana,10.9,ferragens,SILVANA,6
dobradica aco polegadas cartela com unidades cromada silvana,19.9,ferragens,SILVANA,6
braco abs chuveiro eletrico branco lorenzetti,29.9,acess_sanitarios,LORENZETTI,1
braco para chuveiro eletrico abs cromado lorenzetti,58.9,acess_sanitarios,LORENZETTI,1
interruptor tecla cordao abajur a branco ilumi,4.9,interruptores_tomadas,ILUMI,7
interruptor sistema a v branco pial,23.9,interruptores_tomadas,PIAL,7
interruptor sistema tecla paralelo a pial,24.9,interruptores_tomadas,PIAL,7
tomada barra tripla a cinza ilumi,11.9,interruptores_tomadas,ILUMI,7
tomada sobrepor quadrupla p a branca ilumi,16.9,interruptores_tomadas,ILUMI,7
tomada sobrepor p telefonia rj branca ilumi,5.9,interruptores_tomadas,ILUMI,7
tomada sobrepor porcelana p a fx foxlux,5.99,interruptores_tomadas,FOXLUX,7
raspador de tinta e verniz em madeira momfort,16.9,acess_ferramentas,MOMFORT,0
cabo de madeira para picareta momfort,30.9,acess_ferramentas,MOMFORT,0
adesivo pva para madeira g pulvitec,8.9,complementos,PULVITEC,2
cabo de madeira para enxadao momfort,25.9,acess_ferramentas,MOMFORT,0
cabo de madeira para enxada momfort,27.9,acess_ferramentas,MOMFORT,0
cabo de madeira para machado ccm momfort,35.9,acess_ferramentas,MOMFORT,0
lima aco triangular serrote starrett,27.9,acess_ferramentas,STARRETT,0
lima de aco chata murca polegadas com cabo vonder,56.9,acess_ferramentas,VONDER,0
lima de aco meiacana bastarda polegadas encartelada com cabo vonder,48.9,acess_ferramentas,VONDER,0
kit limpa bico aco pecas para macaricos agulhas e lima carbografite,14.9,acess_ferramentas,CARBOGRAFITE,0
tinta acrilica fosca coralar mais desempenho verde limao coral,69.9,tintas,CORAL,10
bone de pele para furadeira bosch,65.9,acess_ferramentas,BOSCH,0
haste adaptadora em aco para furadeira bosch,31.9,acess_ferramentas,BOSCH,0
martelo borracha preto momfort,29.9,acess_ferramentas,MOMFORT,0
martelo de aco n unha tamboreado momfort,44.9,acess_ferramentas,MOMFORT,0
martelo de unha basic com cabo em madeira envernizada tramontina,55.9,acess_ferramentas,TRAMONTINA,0
martelo borrachado g cabo madeira tramontina,94.9,acess_ferramentas,TRAMONTINA,0
martelo borracha branco momfort,27.9,acess_ferramentas,MOMFORT,0
martelo de borracha branco momfort,32.9,acess_ferramentas,MOMFORT,0
martelo de unha e chave fenda polegadas tramontina,48.9,acess_ferramentas,TRAMONTINA,0
martelo aco unha com cabo de madeira tramontina,41.9,acess_ferramentas,TRAMONTINA,0
reparo regua mvs pressao deca,76.9,acess_sanitarios,DECA,1
cabo de madeira para pa reto momfort,25.9,acess_ferramentas,MOMFORT,0
cabo de madeira para marreta a tramontina,17.9,acess_ferramentas,TRAMONTINA,0
pa aco n quadrada com cabo madeira tramontina,28.69,acess_ferramentas,TRAMONTINA,0
pa para bolo inox utilita vermelho tramontina,19.9,cozinha,TRAMONTINA,4
picareta em aco carbono lb pa larga tramontina,97.9,acess_ferramentas,TRAMONTINA,0
panela de pressao em aluminio polida classic panelux,69.9,cozinha,PANELUX,4
panquequeiratapioqueira em aluminio antiaderente magnific grafite panelux,43.9,cozinha,PANELUX,4
aparelho de jantar com pecas ana flor decorado tramontina,399.9,cozinha,TRAMONTINA,4
escova de aco ondulada tipo copo polegadas vonder,51.9,acess_ferramentas,VONDER,0
escova em aco carbono torcida tipo copo rosca vonder,62.9,acess_ferramentas,VONDER,0
escova para grelhas em aco inox para churrasco black tramontina,99.9,cozinha,TRAMONTINA,4
cola branca para biscuit polyfort pulvitec,34.9,complementos,PULVITEC,2
adesivo pva cascola cascorez cola madeira g henkel,15.9,complementos,HENKEL,2
cola plastica universal g branco anjo tintas,42.9,complementos,ANJO,2
canaleta sistema branca ilumi,6.9,interruptores_tomadas,ILUMI,7
balde de plastico para gelo litros gold transparente tr uz utilidades,29.9,cozinha,UZ UTILIDADES,4
balde de plastico para gelo litros gold vermelho vm uz utilidades,28.9,cozinha,UZ UTILIDADES,4
espatula vazada em silicone com cabo de madeira cinza hauskraft,22.9,cozinha,HAUSKRAFT,4
espatula em aco inox para churrasco black tramontina,99.9,cozinha,TRAMONTINA,4
espatula perfurada wavy preto brinox,12.9,cozinha,BRINOX,4
tubo de ligacao flexivel astra,8.9,acess_sanitarios,ASTRA,1
tubo de ligacao flexivel metal cromado c deca,239.9,acess_sanitarios,DECA,1
tubo de ligacao metal flexivel trancado cromado sigma,41.9,acess_sanitarios,SIGMA,1
bico macarico de cobre acetileno numero carbografite,79.9,acess_ferramentas,CARBOGRAFITE,0
bico macarico cobre acetileno n carbografite,53.9,acess_ferramentas,CARBOGRAFITE,0
bico macarico latao acetileno n carbografite,57.9,acess_ferramentas,CARBOGRAFITE,0
piso vinilico hd seringueira vinilforte,99.9,pisos,VINILFORTE,8
piso tatil direcional preto kapazi,12.9,pisos,KAPAZI,8
piso vinilico vita athenna biancogres,98.9,pisos,BIANCOGRES,8
piso vinilico vita baviera biancogres,98.9,pisos,BIANCOGRES,8
cabide metalico cromado pavia sigma,18.9,acess_sanitarios,SIGMA,1
cabide metalico gancho hotel single cromado docol,61.9,acess_sanitarios,DOCOL,1
cabide em metal com gancho flex cromado decacflx,135.9,acess_sanitarios,DECA,1
taca de agua de cristal coracao lyor,14.9,cozinha,LYOR,4
taca de agua de vidro faces lyor,9.9,cozinha,LYOR,4
tubo de ligacao de plastico com canopla e anel de expansao para bacia sanitaria branco astra,19.9,acess_sanitarios,ASTRA,1
parafuso de latao bucha para fixacao de tanque cartela com parafusos sigma,45.9,acess_sanitarios,SIGMA,1
kit para fixacao de mictorio sigma,65.9,acess_sanitarios,SIGMA,1
adesivo contato cascola henkel,199.9,complementos,HENKEL,2
adesivo de contato cascola tradicional g henkel,18.9,complementos,HENKEL,2
adesivo de contato cascola extra sem toluol g henkel,11.9,complementos,HENKEL,2
porta mantimento de vidro com tampa de bambu lyor,19.9,cozinha,LYOR,4
aparelho de jantar pecas donna grecia branco e branco oxford,224.9,cozinha,OXFORD,4
tinta asfaltica neutrol preto vedacit,83.9,complementos,VEDACIT,2
taco para lixa atlas,22.9,acess_ferramentas,ATLAS,0
fechadura externa taco de golfe roseta f cromada silvana,79.9,fechaduras,SILVANA,5
fechadura wc taco golfe roseta ro oxidada silvana,69.9,fechaduras,SILVANA,5
fechadura wc espelho taco golf pc cromado silvana,59.9,fechaduras,SILVANA,5
fechadura interna taco golfespelho po oxidada silvana,63.9,fechaduras,SILVANA,5
fechadura interna taco golf espelho pc cromada silvana,59.9,fechaduras,SILVANA,5
fechadura externa taco golfespelho pc cromada silvana,73.9,fechaduras,SILVANA,5
fechadura externa taco golfespelho po oxidada silvana,79.9,fechaduras,SILVANA,5
fechadura wc taco golfespelho premium pc oxidada silvana,63.9,fechaduras,SILVANA,5
garrafa em policarbonato litro squeeze tie dye lyor,49.9,cozinha,LYOR,4
garrafa em policarbonato litro squeeze com marcadores cinza lyor,29.9,cozinha,LYOR,4
garrafa em policarbonato litro squeeze com marcadores rosa lyor,42.9,cozinha,LYOR,4
colher bambu hauskraft,8.9,cozinha,HAUSKRAFT,4
porta sabonete liquido com reservatorio abs litros branco japi,84.9,cozinha,JAPI,4
refil purificador de agua naturalis lorenzetti,144.9,cozinha,LORENZETTI,4
purificador de agua abs vitale branco lorenzetti,239.9,cozinha,LORENZETTI,4
resina multiuso litros concreto hydronorth,304.9,complementos,HYDRONORTH,2
resina multiuso litros grafite hydronorth,289.9,complementos,HYDRONORTH,2
resina multiuso litros branco hydronorth,226.9,complementos,HYDRONORTH,2
resina multiuso litros ceramica onix hydronorth,304.9,complementos,HYDRONORTH,2
cobre tudo de plastico transparente sanremo,19.9,cozinha,SANREMO,4
mangueira metal para ducha acqua jet cromado tigre,99.9,acess_sanitarios,TIGRE,1
